    1   0.000000 192.168.1.30 → 192.168.1.69 TCP 96 3483 → 59937 [PSH, ACK] Seq=1 Ack=1 Win=253 Len=30 TSval=145003535 TSecr=452879
    2   0.082510 192.168.1.69 → 192.168.1.30 TCP 125 59937 → 3483 [PSH, ACK] Seq=1 Ack=31 Win=2920 Len=59 TSval=453381 TSecr=145003535
    3   0.137788 192.168.1.30 → 192.168.1.69 TCP 66 3483 → 59937 [ACK] Seq=31 Ack=60 Win=252 Len=0 TSval=145003673 TSecr=453381
    4   5.009737 192.168.1.30 → 192.168.1.69 TCP 96 3483 → 59937 [PSH, ACK] Seq=31 Ack=60 Win=252 Len=30 TSval=145008545 TSecr=453381
    5   5.089121 192.168.1.69 → 192.168.1.30 TCP 125 59937 → 3483 [PSH, ACK] Seq=60 Ack=61 Win=2920 Len=59 TSval=453882 TSecr=145008545
    6   5.133030 192.168.1.30 → 192.168.1.69 TCP 66 3483 → 59937 [ACK] Seq=61 Ack=119 Win=252 Len=0 TSval=145008668 TSecr=453882
    7  10.018892 192.168.1.30 → 192.168.1.69 TCP 96 3483 → 59937 [PSH, ACK] Seq=61 Ack=119 Win=252 Len=30 TSval=145013554 TSecr=453882
    8  10.137074 192.168.1.69 → 192.168.1.30 TCP 66 59937 → 3483 [ACK] Seq=119 Ack=91 Win=2920 Len=0 TSval=454387 TSecr=145013554
    9  10.138017 192.168.1.69 → 192.168.1.30 TCP 125 59937 → 3483 [PSH, ACK] Seq=119 Ack=91 Win=2920 Len=59 TSval=454387 TSecr=145013554
   10  10.188301 192.168.1.30 → 192.168.1.69 TCP 66 3483 → 59937 [ACK] Seq=91 Ack=178 Win=252 Len=0 TSval=145013724 TSecr=454387
   11  12.467110 192.168.1.69 → 255.255.255.255 UDP 69 17784 → 17784 Len=27
   12  12.468270 192.168.1.69 → 255.255.255.255 UDP 79 48553 → 3483 Len=37
   13  12.471967 192.168.1.30 → 192.168.1.69 UDP 138 3483 → 48553 Len=96
   14  13.471733 192.168.1.69 → 192.168.1.30 TCP 74 36685 → 9000 [SYN] Seq=0 Win=5840 Len=0 MSS=1460 SACK_PERM TSval=454720 TSecr=0 WS=2
   15  13.471896 192.168.1.30 → 192.168.1.69 TCP 74 9000 → 36685 [SYN, ACK] Seq=0 Ack=1 Win=65535 Len=0 MSS=1460 WS=256 SACK_PERM TSval=145017007 TSecr=454720
   16  13.480345 192.168.1.69 → 192.168.1.30 TCP 66 36685 → 9000 [ACK] Seq=1 Ack=1 Win=5840 Len=0 TSval=454721 TSecr=145017007
   17  13.485288 192.168.1.69 → 192.168.1.30 HTTP 431 POST /cometd HTTP/1.1  (text/json)
   18  13.492521 192.168.1.30 → 192.168.1.69 TCP 191 HTTP/1.1 200 OK 
   19  13.495669 192.168.1.69 → 192.168.1.30 TCP 66 36685 → 9000 [ACK] Seq=366 Ack=126 Win=5840 Len=0 TSval=454723 TSecr=145017028
   20  13.495698 192.168.1.30 → 192.168.1.69 HTTP/JSON 143 HTTP/1.1 200 OK , JSON (application/json)
   21  13.499438 192.168.1.69 → 192.168.1.30 TCP 66 36685 → 9000 [ACK] Seq=366 Ack=203 Win=5840 Len=0 TSval=454723 TSecr=145017031
   22  15.023322 192.168.1.30 → 192.168.1.69 TCP 96 3483 → 59937 [PSH, ACK] Seq=91 Ack=178 Win=252 Len=30 TSval=145018559 TSecr=454387
   23  15.116179 192.168.1.69 → 192.168.1.30 TCP 66 59937 → 3483 [ACK] Seq=178 Ack=121 Win=2920 Len=0 TSval=454885 TSecr=145018559
   24  15.150490 192.168.1.69 → 192.168.1.30 TCP 125 59937 → 3483 [PSH, ACK] Seq=178 Ack=121 Win=2920 Len=59 TSval=454888 TSecr=145018559
   25  15.194526 192.168.1.30 → 192.168.1.69 TCP 66 3483 → 59937 [ACK] Seq=121 Ack=237 Win=252 Len=0 TSval=145018730 TSecr=454888
   26  16.292260 192.168.1.69 → 192.168.1.30 HTTP 390 POST /cometd HTTP/1.1  (text/json)
   27  16.294278 192.168.1.30 → 192.168.1.69 TCP 96 3483 → 59937 [PSH, ACK] Seq=121 Ack=237 Win=252 Len=30 TSval=145019830 TSecr=454888
   28  16.295952 192.168.1.30 → 192.168.1.69 TCP 191 HTTP/1.1 200 OK 
   29  16.301725 192.168.1.69 → 192.168.1.30 TCP 66 36685 → 9000 [ACK] Seq=690 Ack=328 Win=5840 Len=0 TSval=455003 TSecr=145019831
   30  16.301770 192.168.1.30 → 192.168.1.69 HTTP/JSON 143 HTTP/1.1 200 OK , JSON (application/json)
   31  16.304816 192.168.1.69 → 192.168.1.30 TCP 66 36685 → 9000 [ACK] Seq=690 Ack=405 Win=5840 Len=0 TSval=455003 TSecr=145019837
   32  16.334873 192.168.1.69 → 192.168.1.30 TCP 66 59937 → 3483 [ACK] Seq=237 Ack=151 Win=2920 Len=0 TSval=455007 TSecr=145019830
   33  16.334910 192.168.1.30 → 192.168.1.69 TCP 74 3483 → 59937 [PSH, ACK] Seq=151 Ack=237 Win=252 Len=8 TSval=145019870 TSecr=455007
   34  16.339456 192.168.1.69 → 192.168.1.30 TCP 66 59937 → 3483 [ACK] Seq=237 Ack=159 Win=2920 Len=0 TSval=455007 TSecr=145019870
   35  16.788860 192.168.1.69 → 192.168.1.30 TCP 125 59937 → 3483 [PSH, ACK] Seq=237 Ack=159 Win=2920 Len=59 TSval=455052 TSecr=145019870
   36  16.843967 192.168.1.30 → 192.168.1.69 TCP 66 3483 → 59937 [ACK] Seq=159 Ack=296 Win=252 Len=0 TSval=145020379 TSecr=455052
   37  16.861133 192.168.1.69 → 192.168.1.30 TCP 125 59937 → 3483 [PSH, ACK] Seq=296 Ack=159 Win=2920 Len=59 TSval=455059 TSecr=145020379
   38  16.906160 192.168.1.30 → 192.168.1.69 TCP 66 3483 → 59937 [ACK] Seq=159 Ack=355 Win=251 Len=0 TSval=145020441 TSecr=455059
   39  18.472472 192.168.1.69 → 192.168.1.30 HTTP 390 POST /cometd HTTP/1.1  (text/json)
   40  18.473669 192.168.1.69 → 255.255.255.255 WOL 144 MagicPacket for ProxmoxServe_30:44:65 (bc:24:11:30:44:65)
   41  18.474070 192.168.1.30 → 192.168.1.69 TCP 74 3483 → 59937 [PSH, ACK] Seq=159 Ack=355 Win=251 Len=8 TSval=145022009 TSecr=455059
   42  18.474908 192.168.1.30 → 192.168.1.69 TCP 191 HTTP/1.1 200 OK 
   43  18.478887 192.168.1.69 → 192.168.1.30 TCP 66 59937 → 3483 [ACK] Seq=355 Ack=167 Win=2920 Len=0 TSval=455221 TSecr=145022009
   44  18.480955 192.168.1.69 → 192.168.1.30 TCP 66 36685 → 9000 [ACK] Seq=1014 Ack=530 Win=5840 Len=0 TSval=455221 TSecr=145022010
   45  18.480995 192.168.1.30 → 192.168.1.69 HTTP/JSON 143 HTTP/1.1 200 OK , JSON (application/json)
   46  18.484372 192.168.1.69 → 192.168.1.30 TCP 66 36685 → 9000 [ACK] Seq=1014 Ack=607 Win=5840 Len=0 TSval=455221 TSecr=145022016
   47  18.616946 192.168.1.69 → 192.168.1.30 TCP 125 59937 → 3483 [PSH, ACK] Seq=355 Ack=167 Win=2920 Len=59 TSval=455235 TSecr=145022009
   48  18.662508 192.168.1.30 → 192.168.1.69 TCP 66 3483 → 59937 [ACK] Seq=167 Ack=414 Win=251 Len=0 TSval=145022198 TSecr=455235
   49  20.033283 192.168.1.30 → 192.168.1.69 TCP 96 3483 → 59937 [PSH, ACK] Seq=167 Ack=414 Win=251 Len=30 TSval=145023569 TSecr=455235
   50  20.133686 192.168.1.69 → 192.168.1.30 TCP 66 59937 → 3483 [ACK] Seq=414 Ack=197 Win=2920 Len=0 TSval=455386 TSecr=145023569
   51  20.152483 192.168.1.69 → 192.168.1.30 TCP 125 59937 → 3483 [PSH, ACK] Seq=414 Ack=197 Win=2920 Len=59 TSval=455388 TSecr=145023569
   52  20.204076 192.168.1.30 → 192.168.1.69 TCP 66 3483 → 59937 [ACK] Seq=197 Ack=473 Win=251 Len=0 TSval=145023739 TSecr=455388
   53  20.971621 192.168.1.69 → 192.168.1.30 TCP 66 59937 → 3483 [FIN, ACK] Seq=473 Ack=197 Win=2920 Len=0 TSval=455470 TSecr=145023739
   54  20.971729 192.168.1.30 → 192.168.1.69 TCP 66 3483 → 59937 [ACK] Seq=197 Ack=474 Win=251 Len=0 TSval=145024507 TSecr=455470
   55  20.973081 192.168.1.30 → 192.168.1.69 TCP 66 3483 → 59937 [FIN, ACK] Seq=197 Ack=474 Win=251 Len=0 TSval=145024508 TSecr=455470
   56  20.979600 192.168.1.69 → 192.168.1.30 TCP 66 59937 → 3483 [ACK] Seq=474 Ack=198 Win=2920 Len=0 TSval=455471 TSecr=145024508
   57  21.023359 192.168.1.69 → 192.168.1.30 HTTP 293 POST /cometd HTTP/1.1  (text/json)
   58  21.024664 192.168.1.30 → 192.168.1.69 TCP 191 HTTP/1.1 200 OK 
   59  21.029586 192.168.1.69 → 192.168.1.30 TCP 66 36685 → 9000 [ACK] Seq=1241 Ack=732 Win=5840 Len=0 TSval=455476 TSecr=145024560
   60  21.029638 192.168.1.30 → 192.168.1.69 HTTP/JSON 138 HTTP/1.1 200 OK , JSON (application/json)
   61  21.032689 192.168.1.69 → 192.168.1.30 TCP 66 36685 → 9000 [ACK] Seq=1241 Ack=804 Win=5840 Len=0 TSval=455476 TSecr=145024565
   62  21.213151 192.168.1.69 → 192.168.1.30 TCP 66 36685 → 9000 [FIN, ACK] Seq=1241 Ack=804 Win=5840 Len=0 TSval=455494 TSecr=145024565
   63  21.213280 192.168.1.30 → 192.168.1.69 TCP 66 9000 → 36685 [ACK] Seq=804 Ack=1242 Win=64256 Len=0 TSval=145024748 TSecr=455494
   64  21.213479 192.168.1.30 → 192.168.1.69 TCP 66 9000 → 36685 [FIN, ACK] Seq=804 Ack=1242 Win=64256 Len=0 TSval=145024749 TSecr=455494
   65  21.221414 192.168.1.69 → 192.168.1.30 TCP 66 36685 → 9000 [ACK] Seq=1242 Ack=805 Win=5840 Len=0 TSval=455495 TSecr=145024749
   66  21.335961 192.168.1.69 → 192.168.1.30 TCP 74 36686 → 9000 [SYN] Seq=0 Win=5840 Len=0 MSS=1460 SACK_PERM TSval=455506 TSecr=0 WS=2
   67  21.336184 192.168.1.30 → 192.168.1.69 TCP 74 9000 → 36686 [SYN, ACK] Seq=0 Ack=1 Win=65535 Len=0 MSS=1460 WS=256 SACK_PERM TSval=145024871 TSecr=455506
   68  21.339956 192.168.1.69 → 192.168.1.30 TCP 66 36686 → 9000 [ACK] Seq=1 Ack=1 Win=5840 Len=0 TSval=455507 TSecr=145024871
   69  21.747826 192.168.1.69 → 192.168.1.30 HTTP 425 POST /cometd HTTP/1.1  (text/json)
   70  21.749243 192.168.1.30 → 192.168.1.69 TCP 192 HTTP/1.1 200 OK 
   71  21.756039 192.168.1.69 → 192.168.1.30 TCP 66 36686 → 9000 [ACK] Seq=360 Ack=127 Win=5840 Len=0 TSval=455548 TSecr=145025285
   72  21.756077 192.168.1.30 → 192.168.1.69 HTTP/JSON 277 HTTP/1.1 200 OK , JSON (application/json)
   73  21.801401 192.168.1.69 → 192.168.1.30 TCP 66 36686 → 9000 [ACK] Seq=360 Ack=338 Win=6912 Len=0 TSval=455553 TSecr=145025291
   74  21.853416 192.168.1.69 → 255.255.255.255 WOL 144 MagicPacket for ProxmoxServe_30:44:65 (bc:24:11:30:44:65)
   75  21.886430 192.168.1.69 → 192.168.1.30 HTTP 406 POST /cometd HTTP/1.1  (text/json)
   76  21.895378 192.168.1.30 → 192.168.1.69 TCP 248 HTTP/1.1 200 OK 
   77  21.899813 192.168.1.69 → 192.168.1.30 TCP 66 36686 → 9000 [ACK] Seq=700 Ack=520 Win=6912 Len=0 TSval=455563 TSecr=145025431
   78  21.899863 192.168.1.30 → 192.168.1.69 TCP 322 HTTP/1.1 200 OK  [TCP PDU reassembled in 78]
   79  21.903285 192.168.1.69 → 192.168.1.30 TCP 66 36686 → 9000 [ACK] Seq=700 Ack=776 Win=7984 Len=0 TSval=455563 TSecr=145025435
   80  21.988673 192.168.1.69 → 192.168.1.30 TCP 74 36687 → 9000 [SYN] Seq=0 Win=5840 Len=0 MSS=1460 SACK_PERM TSval=455572 TSecr=0 WS=2
   81  21.988814 192.168.1.30 → 192.168.1.69 TCP 74 9000 → 36687 [SYN, ACK] Seq=0 Ack=1 Win=65535 Len=0 MSS=1460 WS=256 SACK_PERM TSval=145025524 TSecr=455572
   82  21.991852 192.168.1.69 → 192.168.1.30 TCP 66 36687 → 9000 [ACK] Seq=1 Ack=1 Win=5840 Len=0 TSval=455572 TSecr=145025524
   83  22.195546 SlimDevices_26:84:ae → Broadcast    ARP 60 Who has 192.168.1.1? Tell 192.168.1.69
   84  22.277213 192.168.1.69 → 192.168.1.30 HTTP 1302 POST /cometd HTTP/1.1  (text/json)
   85  22.287668 192.168.1.30 → 192.168.1.69 TCP 192 HTTP/1.1 200 OK 
   86  22.288366 192.168.1.30 → 192.168.1.69 TCP 1091 HTTP/1.1 200 OK  [TCP PDU reassembled in 86]
   87  22.291032 192.168.1.69 → 192.168.1.30 TCP 66 36687 → 9000 [ACK] Seq=1237 Ack=127 Win=5840 Len=0 TSval=455602 TSecr=145025823
   88  22.291060 192.168.1.30 → 192.168.1.69 HTTP/JSON 529 HTTP/1.1 200 OK , JSON (application/json)
   89  22.293458 192.168.1.69 → 192.168.1.30 TCP 66 36686 → 9000 [ACK] Seq=700 Ack=1801 Win=10034 Len=0 TSval=455602 TSecr=145025823
   90  22.295096 192.168.1.69 → 192.168.1.30 TCP 66 36687 → 9000 [ACK] Seq=1237 Ack=590 Win=6912 Len=0 TSval=455602 TSecr=145025826
   91  22.358994 192.168.1.69 → 255.255.255.255 UDP 69 17784 → 17784 Len=27
   92  22.360814 192.168.1.69 → 255.255.255.255 UDP 79 48553 → 3483 Len=37
   93  22.365015 192.168.1.30 → 192.168.1.69 UDP 138 3483 → 48553 Len=96
   94  22.604435 192.168.1.69 → 192.168.1.30 HTTP 474 POST /cometd HTTP/1.1  (text/json)
   95  22.605654 192.168.1.30 → 192.168.1.69 TCP 192 HTTP/1.1 200 OK 
   96  22.610029 192.168.1.69 → 192.168.1.30 TCP 66 36687 → 9000 [ACK] Seq=1645 Ack=716 Win=6912 Len=0 TSval=455634 TSecr=145026141
   97  22.610060 192.168.1.30 → 192.168.1.69 HTTP/JSON 211 HTTP/1.1 200 OK , JSON (application/json)
   98  22.613248 192.168.1.69 → 192.168.1.30 TCP 66 36687 → 9000 [ACK] Seq=1645 Ack=861 Win=6912 Len=0 TSval=455634 TSecr=145026145
   99  22.699774 192.168.1.69 → 192.168.1.30 HTTP 354 POST /cometd HTTP/1.1  (text/json)
  100  22.700818 192.168.1.30 → 192.168.1.69 TCP 191 HTTP/1.1 200 OK 
  101  22.703985 192.168.1.69 → 192.168.1.30 TCP 66 36687 → 9000 [ACK] Seq=1933 Ack=986 Win=6912 Len=0 TSval=455643 TSecr=145026236
  102  22.704014 192.168.1.30 → 192.168.1.69 HTTP/JSON 139 HTTP/1.1 200 OK , JSON (application/json)
  103  22.708495 192.168.1.69 → 192.168.1.30 TCP 66 36687 → 9000 [ACK] Seq=1933 Ack=1059 Win=6912 Len=0 TSval=455644 TSecr=145026239
  104  22.717663 192.168.1.69 → 192.168.1.30 HTTP 354 POST /cometd HTTP/1.1  (text/json)
  105  22.718460 192.168.1.30 → 192.168.1.69 TCP 191 HTTP/1.1 200 OK 
  106  22.724091 192.168.1.69 → 255.255.255.255 UDP 69 17784 → 17784 Len=27
  107  22.726013 192.168.1.69 → 255.255.255.255 UDP 79 48553 → 3483 Len=37
  108  22.729756 192.168.1.30 → 192.168.1.69 UDP 138 3483 → 48553 Len=96
  109  22.755451 192.168.1.69 → 192.168.1.30 TCP 66 36687 → 9000 [ACK] Seq=2221 Ack=1184 Win=6912 Len=0 TSval=455649 TSecr=145026253
  110  22.755491 192.168.1.30 → 192.168.1.69 HTTP/JSON 139 HTTP/1.1 200 OK , JSON (application/json)
  111  22.790281 192.168.1.69 → 192.168.1.30 TCP 66 36687 → 9000 [ACK] Seq=2221 Ack=1257 Win=6912 Len=0 TSval=455652 TSecr=145026291
  112  27.729352 192.168.1.30 → 192.168.1.69 TCP 66 9000 → 36687 [FIN, ACK] Seq=1257 Ack=2221 Win=64768 Len=0 TSval=145031265 TSecr=455652
  113  28.041048 192.168.1.30 → 192.168.1.69 TCP 66 [TCP Retransmission] 9000 → 36687 [FIN, ACK] Seq=1257 Ack=2221 Win=64768 Len=0 TSval=145031576 TSecr=455652
  114  28.648987 192.168.1.30 → 192.168.1.69 TCP 66 [TCP Retransmission] 9000 → 36687 [FIN, ACK] Seq=1257 Ack=2221 Win=64768 Len=0 TSval=145032184 TSecr=455652
  115  29.858683 192.168.1.30 → 192.168.1.69 TCP 66 [TCP Retransmission] 9000 → 36687 [FIN, ACK] Seq=1257 Ack=2221 Win=64768 Len=0 TSval=145033394 TSecr=455652
  116  32.270582 192.168.1.30 → 192.168.1.69 TCP 66 [TCP Retransmission] 9000 → 36687 [FIN, ACK] Seq=1257 Ack=2221 Win=64768 Len=0 TSval=145035806 TSecr=455652
  117  33.497386 ProxmoxServe_30:44:65 → SlimDevices_26:84:ae ARP 42 Who has 192.168.1.69? Tell 192.168.1.30
  118  34.495829 ProxmoxServe_30:44:65 → SlimDevices_26:84:ae ARP 42 Who has 192.168.1.69? Tell 192.168.1.30
  119  35.489069 ProxmoxServe_30:44:65 → SlimDevices_26:84:ae ARP 42 Who has 192.168.1.69? Tell 192.168.1.30
  120  37.082661 ProxmoxServe_30:44:65 → Broadcast    ARP 42 Who has 192.168.1.69? Tell 192.168.1.30
  121  37.985398 ProxmoxServe_30:44:65 → Broadcast    ARP 42 Who has 192.168.1.69? Tell 192.168.1.30
  122  38.995965 ProxmoxServe_30:44:65 → Broadcast    ARP 42 Who has 192.168.1.69? Tell 192.168.1.30
  123  46.686869 ProxmoxServe_30:44:65 → Broadcast    ARP 42 Who has 192.168.1.69? Tell 192.168.1.30
  124  47.495869 ProxmoxServe_30:44:65 → Broadcast    ARP 42 Who has 192.168.1.69? Tell 192.168.1.30
  125  48.492952 ProxmoxServe_30:44:65 → Broadcast    ARP 42 Who has 192.168.1.69? Tell 192.168.1.30
  126  52.613913 ProxmoxServe_30:44:65 → Broadcast    ARP 42 Who has 192.168.1.69? Tell 192.168.1.30
  127  53.499534 ProxmoxServe_30:44:65 → Broadcast    ARP 42 Who has 192.168.1.69? Tell 192.168.1.30
  128  54.491545 ProxmoxServe_30:44:65 → Broadcast    ARP 42 Who has 192.168.1.69? Tell 192.168.1.30
  129  54.666986 SlimDevices_26:84:ae → Broadcast    ARP 60 Who has 192.168.1.69? (ARP Probe)
  130  57.371746 ProxmoxServe_30:44:65 → Broadcast    ARP 42 Who has 192.168.1.69? Tell 192.168.1.30
  131  57.408640 SlimDevices_26:84:ae → ProxmoxServe_30:44:65 ARP 60 192.168.1.69 is at 00:04:20:26:84:ae
  132  57.408676 192.168.1.30 → 192.168.1.69 TCP 121 HTTP/1.1 200 OK  [TCP PDU reassembled in 132]
  133  57.411837 192.168.1.69 → 192.168.1.30 TCP 60 36686 → 9000 [RST] Seq=700 Win=0 Len=0
  134  57.826634 SlimDevices_26:84:ae → Broadcast    ARP 60 Who has 192.168.1.3? Tell 192.168.1.69
  135  62.408886 SlimDevices_26:84:ae → ProxmoxServe_30:44:65 ARP 60 Who has 192.168.1.30? Tell 192.168.1.69
  136  62.408903 ProxmoxServe_30:44:65 → SlimDevices_26:84:ae ARP 42 192.168.1.30 is at bc:24:11:30:44:65
  137  72.592577 192.168.1.69 → 192.168.1.30 TCP 74 36717 → 3483 [SYN] Seq=0 Win=5840 Len=0 MSS=1460 SACK_PERM TSval=4294941524 TSecr=0 WS=2
  138  72.592823 192.168.1.30 → 192.168.1.69 TCP 74 3483 → 36717 [SYN, ACK] Seq=0 Ack=1 Win=65535 Len=0 MSS=1460 WS=256 SACK_PERM TSval=145076128 TSecr=4294941524
  139  72.613657 192.168.1.69 → 192.168.1.30 TCP 66 36717 → 3483 [ACK] Seq=1 Ack=1 Win=5840 Len=0 TSval=4294941526 TSecr=145076128
  140  72.627262 192.168.1.69 → 255.255.255.255 WOL 144 MagicPacket for ProxmoxServe_30:44:65 (bc:24:11:30:44:65)
  141  72.638157 192.168.1.69 → 255.255.255.255 UDP 69 17784 → 17784 Len=27
  142  72.640467 192.168.1.69 → 255.255.255.255 UDP 79 38985 → 3483 Len=37
  143  72.641378 192.168.1.69 → 192.168.1.30 TCP 295 36717 → 3483 [PSH, ACK] Seq=1 Ack=1 Win=5840 Len=229 TSval=4294941529 TSecr=145076128
  144  72.643406 192.168.1.30 → 192.168.1.69 UDP 138 3483 → 38985 Len=96
  145  72.644784 192.168.1.30 → 192.168.1.69 TCP 81 3483 → 36717 [PSH, ACK] Seq=1 Ack=230 Win=65280 Len=15 TSval=145076180 TSecr=4294941529
  146  72.650716 192.168.1.69 → 192.168.1.30 TCP 66 36717 → 3483 [ACK] Seq=230 Ack=16 Win=5840 Len=0 TSval=4294941530 TSecr=145076180
  147  72.650743 192.168.1.30 → 192.168.1.69 TCP 146 3483 → 36717 [PSH, ACK] Seq=16 Ack=230 Win=65280 Len=80 TSval=145076186 TSecr=4294941530
  148  72.656750 192.168.1.69 → 192.168.1.30 TCP 66 36717 → 3483 [ACK] Seq=230 Ack=96 Win=5840 Len=0 TSval=4294941530 TSecr=145076186
  149  72.658572 SlimDevices_26:84:ae → Broadcast    ARP 60 Who has 192.168.1.35? Tell 192.168.1.69
  150  72.712964 192.168.1.69 → 192.168.1.30 TCP 74 51294 → 9000 [SYN] Seq=0 Win=5840 Len=0 MSS=1460 SACK_PERM TSval=4294941536 TSecr=0 WS=2
  151  72.713099 192.168.1.30 → 192.168.1.69 TCP 74 9000 → 51294 [SYN, ACK] Seq=0 Ack=1 Win=65535 Len=0 MSS=1460 WS=256 SACK_PERM TSval=145076248 TSecr=4294941536
  152  72.717633 192.168.1.69 → 192.168.1.30 TCP 66 51294 → 9000 [ACK] Seq=1 Ack=1 Win=5840 Len=0 TSval=4294941537 TSecr=145076248
  153  72.741160 192.168.1.69 → 192.168.1.30 HTTP 425 POST /cometd HTTP/1.1  (text/json)
  154  72.742461 192.168.1.30 → 192.168.1.69 TCP 192 HTTP/1.1 200 OK 
  155  72.743246 192.168.1.69 → 192.168.1.30 TCP 125 36717 → 3483 [PSH, ACK] Seq=230 Ack=96 Win=5840 Len=59 TSval=4294941539 TSecr=145076186
  156  72.746996 192.168.1.69 → 192.168.1.30 TCP 66 51294 → 9000 [ACK] Seq=360 Ack=127 Win=5840 Len=0 TSval=4294941539 TSecr=145076278
  157  72.747023 192.168.1.30 → 192.168.1.69 HTTP/JSON 277 HTTP/1.1 200 OK , JSON (application/json)
  158  72.750586 192.168.1.69 → 192.168.1.30 TCP 66 51294 → 9000 [ACK] Seq=360 Ack=338 Win=6912 Len=0 TSval=4294941540 TSecr=145076282
  159  72.784820 192.168.1.69 → 192.168.1.30 HTTP 406 POST /cometd HTTP/1.1  (text/json)
  160  72.786497 192.168.1.30 → 192.168.1.69 TCP 248 HTTP/1.1 200 OK 
  161  72.795643 192.168.1.30 → 192.168.1.69 TCP 66 3483 → 36717 [ACK] Seq=96 Ack=289 Win=65024 Len=0 TSval=145076331 TSecr=4294941539
  162  72.798710 192.168.1.69 → 192.168.1.30 TCP 196 36717 → 3483 [PSH, ACK] Seq=289 Ack=96 Win=5840 Len=130 TSval=4294941545 TSecr=145076331
  163  72.827144 192.168.1.69 → 192.168.1.30 TCP 66 51294 → 9000 [ACK] Seq=700 Ack=520 Win=6912 Len=0 TSval=4294941548 TSecr=145076322
  164  72.827183 192.168.1.30 → 192.168.1.69 TCP 322 HTTP/1.1 200 OK  [TCP PDU reassembled in 164]
  165  72.830902 192.168.1.69 → 192.168.1.30 TCP 66 51294 → 9000 [ACK] Seq=700 Ack=776 Win=7984 Len=0 TSval=4294941548 TSecr=145076362
  166  72.842317 192.168.1.30 → 192.168.1.69 TCP 66 3483 → 36717 [ACK] Seq=96 Ack=419 Win=65024 Len=0 TSval=145076378 TSecr=4294941545
  167  72.847066 192.168.1.69 → 192.168.1.30 TCP 243 36717 → 3483 [PSH, ACK] Seq=419 Ack=96 Win=5840 Len=177 TSval=4294941549 TSecr=145076378
  168  72.848436 192.168.1.69 → 192.168.1.30 TCP 74 51295 → 9000 [SYN] Seq=0 Win=5840 Len=0 MSS=1460 SACK_PERM TSval=4294941550 TSecr=0 WS=2
  169  72.848572 192.168.1.30 → 192.168.1.69 TCP 74 9000 → 51295 [SYN, ACK] Seq=0 Ack=1 Win=65535 Len=0 MSS=1460 WS=256 SACK_PERM TSval=145076384 TSecr=4294941550
  170  72.851512 192.168.1.69 → 192.168.1.30 TCP 66 51295 → 9000 [ACK] Seq=1 Ack=1 Win=5840 Len=0 TSval=4294941550 TSecr=145076384
  171  72.888841 192.168.1.30 → 192.168.1.69 TCP 66 3483 → 36717 [ACK] Seq=96 Ack=596 Win=64768 Len=0 TSval=145076424 TSecr=4294941549
  172  72.912430 192.168.1.69 → 192.168.1.30 HTTP 584 POST /cometd HTTP/1.1  (text/json)
  173  72.918478 192.168.1.30 → 192.168.1.69 TCP 192 HTTP/1.1 200 OK 
  174  72.919051 192.168.1.30 → 192.168.1.69 TCP 725 HTTP/1.1 200 OK  [TCP PDU reassembled in 174]
  175  72.921556 192.168.1.69 → 192.168.1.30 TCP 66 51295 → 9000 [ACK] Seq=519 Ack=127 Win=5840 Len=0 TSval=4294941557 TSecr=145076454
  176  72.921589 192.168.1.30 → 192.168.1.69 HTTP/JSON 221 HTTP/1.1 200 OK , JSON (application/json)
  177  72.923428 192.168.1.69 → 192.168.1.30 TCP 66 51294 → 9000 [ACK] Seq=700 Ack=1435 Win=9302 Len=0 TSval=4294941557 TSecr=145076454
  178  72.928704 192.168.1.69 → 192.168.1.30 TCP 66 51295 → 9000 [ACK] Seq=519 Ack=282 Win=5840 Len=0 TSval=4294941557 TSecr=145076457
  179  73.188568 192.168.1.69 → 192.168.1.30 HTTP 406 POST /cometd HTTP/1.1  (text/json)
  180  73.190350 192.168.1.30 → 192.168.1.69 TCP 191 HTTP/1.1 200 OK 
  181  73.191130 192.168.1.30 → 192.168.1.69 TCP 289 HTTP/1.1 200 OK  [TCP PDU reassembled in 181]
  182  73.193614 192.168.1.69 → 192.168.1.30 TCP 66 51295 → 9000 [ACK] Seq=859 Ack=407 Win=5840 Len=0 TSval=4294941584 TSecr=145076726
  183  73.193644 192.168.1.30 → 192.168.1.69 HTTP/JSON 144 HTTP/1.1 200 OK , JSON (application/json)
  184  73.195043 192.168.1.69 → 192.168.1.30 TCP 66 51294 → 9000 [ACK] Seq=700 Ack=1658 Win=9302 Len=0 TSval=4294941584 TSecr=145076726
  185  73.199144 192.168.1.69 → 192.168.1.30 TCP 66 51295 → 9000 [ACK] Seq=859 Ack=485 Win=5840 Len=0 TSval=4294941585 TSecr=145076729
  186  73.207967 192.168.1.69 → 192.168.1.30 HTTP 395 POST /cometd HTTP/1.1  (text/json)
  187  73.209543 192.168.1.30 → 192.168.1.69 TCP 191 HTTP/1.1 200 OK 
  188  73.222595 192.168.1.69 → 255.255.255.255 UDP 69 17784 → 17784 Len=27
  189  73.224228 192.168.1.69 → 255.255.255.255 UDP 79 38985 → 3483 Len=37
  190  73.227242 192.168.1.30 → 192.168.1.69 UDP 138 3483 → 38985 Len=96
  191  73.237000 192.168.1.69 → 192.168.1.30 HTTP 382 POST /cometd HTTP/1.1  (text/json)
  192  73.237125 192.168.1.30 → 192.168.1.69 HTTP/JSON 144 HTTP/1.1 200 OK , JSON (application/json)
  193  73.239045 192.168.1.30 → 192.168.1.69 TCP 2645 HTTP/1.1 200 OK  [TCP PDU reassembled in 193]
  194  73.243979 192.168.1.69 → 192.168.1.30 TCP 66 51294 → 9000 [ACK] Seq=700 Ack=3106 Win=12198 Len=0 TSval=4294941589 TSecr=145076774
  195  73.251890 192.168.1.69 → 192.168.1.30 TCP 66 51294 → 9000 [ACK] Seq=700 Ack=4237 Win=15094 Len=0 TSval=4294941590 TSecr=145076774
  196  73.277613 192.168.1.69 → 192.168.1.30 TCP 66 51295 → 9000 [ACK] Seq=1504 Ack=688 Win=5840 Len=0 TSval=4294941593 TSecr=145076772
  197  73.277648 192.168.1.30 → 192.168.1.69 HTTP/JSON 267 HTTP/1.1 200 OK , JSON (application/json)
  198  73.282184 192.168.1.69 → 192.168.1.30 TCP 66 51295 → 9000 [ACK] Seq=1504 Ack=889 Win=6912 Len=0 TSval=4294941593 TSecr=145076813
  199  73.924842 192.168.1.69 → 192.168.1.30 HTTP 798 POST /cometd HTTP/1.1  (text/json)
  200  73.928490 192.168.1.30 → 192.168.1.69 TCP 192 HTTP/1.1 200 OK 
  201  73.929188 192.168.1.30 → 192.168.1.69 TCP 827 HTTP/1.1 200 OK  [TCP PDU reassembled in 201]
  202  73.931683 192.168.1.69 → 192.168.1.30 TCP 66 51295 → 9000 [ACK] Seq=2236 Ack=1015 Win=6912 Len=0 TSval=4294941658 TSecr=145077464
  203  73.931717 192.168.1.30 → 192.168.1.69 HTTP/JSON 296 HTTP/1.1 200 OK , JSON (application/json)
  204  73.933557 192.168.1.69 → 192.168.1.30 TCP 66 51294 → 9000 [ACK] Seq=700 Ack=4998 Win=17990 Len=0 TSval=4294941658 TSecr=145077464
  205  73.936720 192.168.1.69 → 192.168.1.30 TCP 66 51295 → 9000 [ACK] Seq=2236 Ack=1245 Win=7984 Len=0 TSval=4294941658 TSecr=145077467
  206  75.116387 192.168.1.30 → 192.168.1.69 TCP 96 3483 → 36717 [PSH, ACK] Seq=96 Ack=596 Win=64768 Len=30 TSval=145078652 TSecr=4294941549
  207  75.224333 192.168.1.69 → 192.168.1.30 TCP 66 36717 → 3483 [ACK] Seq=596 Ack=126 Win=5840 Len=0 TSval=4294941787 TSecr=145078652
  208  75.234271 192.168.1.69 → 192.168.1.30 TCP 125 36717 → 3483 [PSH, ACK] Seq=596 Ack=126 Win=5840 Len=59 TSval=4294941788 TSecr=145078652
  209  75.285564 192.168.1.30 → 192.168.1.69 TCP 66 3483 → 36717 [ACK] Seq=126 Ack=655 Win=64768 Len=0 TSval=145078821 TSecr=4294941788
  210  78.939949 192.168.1.30 → 192.168.1.69 TCP 66 9000 → 51295 [FIN, ACK] Seq=1245 Ack=2236 Win=64768 Len=0 TSval=145082475 TSecr=4294941658
  211  79.016727 192.168.1.69 → 192.168.1.30 TCP 66 51295 → 9000 [FIN, ACK] Seq=2236 Ack=1246 Win=7984 Len=0 TSval=4294942166 TSecr=145082475
  212  79.016841 192.168.1.30 → 192.168.1.69 TCP 66 9000 → 51295 [ACK] Seq=1246 Ack=2237 Win=64768 Len=0 TSval=145082552 TSecr=4294942166
  213  80.120212 192.168.1.30 → 192.168.1.69 TCP 96 3483 → 36717 [PSH, ACK] Seq=126 Ack=655 Win=64768 Len=30 TSval=145083655 TSecr=4294941788
  214  80.148116 192.168.1.69 → 192.168.1.30 TCP 125 36717 → 3483 [PSH, ACK] Seq=655 Ack=156 Win=5840 Len=59 TSval=4294942280 TSecr=145083655
  215  80.195738 192.168.1.30 → 192.168.1.69 TCP 66 3483 → 36717 [ACK] Seq=156 Ack=714 Win=64768 Len=0 TSval=145083731 TSecr=4294942280
  216  84.005925 192.168.1.69 → 192.168.1.30 TCP 74 51297 → 9000 [SYN] Seq=0 Win=5840 Len=0 MSS=1460 SACK_PERM TSval=4294942665 TSecr=0 WS=2
  217  84.006107 192.168.1.30 → 192.168.1.69 TCP 74 9000 → 51297 [SYN, ACK] Seq=0 Ack=1 Win=65535 Len=0 MSS=1460 WS=256 SACK_PERM TSval=145087541 TSecr=4294942665
  218  84.009046 192.168.1.69 → 192.168.1.30 TCP 66 51297 → 9000 [ACK] Seq=1 Ack=1 Win=5840 Len=0 TSval=4294942666 TSecr=145087541
  219  84.023360 192.168.1.69 → 192.168.1.30 HTTP 430 POST /cometd HTTP/1.1  (text/json)
  220  84.027874 192.168.1.30 → 192.168.1.69 TCP 191 HTTP/1.1 200 OK 
  221  84.028344 192.168.1.30 → 192.168.1.69 TCP 593 HTTP/1.1 200 OK  [TCP PDU reassembled in 221]
  222  84.033875 192.168.1.69 → 192.168.1.30 TCP 66 51297 → 9000 [ACK] Seq=365 Ack=126 Win=5840 Len=0 TSval=4294942668 TSecr=145087563
  223  84.033913 192.168.1.30 → 192.168.1.69 HTTP/JSON 142 HTTP/1.1 200 OK , JSON (application/json)
  224  84.034753 192.168.1.69 → 192.168.1.30 TCP 66 51294 → 9000 [ACK] Seq=700 Ack=5525 Win=17990 Len=0 TSval=4294942668 TSecr=145087563
  225  84.038732 192.168.1.69 → 192.168.1.30 TCP 66 51297 → 9000 [ACK] Seq=365 Ack=202 Win=5840 Len=0 TSval=4294942669 TSecr=145087569
  226  84.402852 192.168.1.69 → 192.168.1.30 TCP 74 51298 → 9000 [SYN] Seq=0 Win=5840 Len=0 MSS=1460 SACK_PERM TSval=4294942705 TSecr=0 WS=2
  227  84.403022 192.168.1.30 → 192.168.1.69 TCP 74 9000 → 51298 [SYN, ACK] Seq=0 Ack=1 Win=65535 Len=0 MSS=1460 WS=256 SACK_PERM TSval=145087938 TSecr=4294942705
  228  84.408622 192.168.1.69 → 192.168.1.30 TCP 66 51298 → 9000 [ACK] Seq=1 Ack=1 Win=5840 Len=0 TSval=4294942705 TSecr=145087938
  229  84.477732 192.168.1.69 → 192.168.1.30 HTTP 206 GET /music/3/cover_41x41_m HTTP/1.1 
  230  84.529918 192.168.1.30 → 192.168.1.69 TCP 66 9000 → 51298 [ACK] Seq=1 Ack=141 Win=65280 Len=0 TSval=145088065 TSecr=4294942712
  231  84.564674 192.168.1.30 → 192.168.1.69 TCP 267 HTTP/1.1 200 OK 
  232  84.568856 192.168.1.69 → 192.168.1.30 TCP 66 51298 → 9000 [ACK] Seq=141 Ack=202 Win=6912 Len=0 TSval=4294942722 TSecr=145088100
  233  84.568897 192.168.1.30 → 192.168.1.69 HTTP 1456 HTTP/1.1 200 OK  (JPEG JFIF image)
  234  84.574423 192.168.1.69 → 192.168.1.30 TCP 66 51298 → 9000 [ACK] Seq=141 Ack=1592 Win=9692 Len=0 TSval=4294942722 TSecr=145088104
  235  85.136418 192.168.1.30 → 192.168.1.69 TCP 96 3483 → 36717 [PSH, ACK] Seq=156 Ack=714 Win=64768 Len=30 TSval=145088672 TSecr=4294942280
  236  85.167624 192.168.1.69 → 192.168.1.30 TCP 125 36717 → 3483 [PSH, ACK] Seq=714 Ack=186 Win=5840 Len=59 TSval=4294942781 TSecr=145088672
  237  85.212422 192.168.1.30 → 192.168.1.69 TCP 66 3483 → 36717 [ACK] Seq=186 Ack=773 Win=64512 Len=0 TSval=145088748 TSecr=4294942781
  238  85.921867 192.168.1.69 → 192.168.1.30 HTTP 444 POST /cometd HTTP/1.1  (text/json)
  239  85.926796 192.168.1.30 → 192.168.1.69 TCP 191 HTTP/1.1 200 OK 
  240  85.927400 192.168.1.30 → 192.168.1.69 TCP 10726 HTTP/1.1 200 OK  [TCP PDU reassembled in 240]
  241  85.931522 192.168.1.69 → 192.168.1.30 TCP 66 51297 → 9000 [ACK] Seq=743 Ack=327 Win=5840 Len=0 TSval=4294942858 TSecr=145089462
  242  85.931556 192.168.1.30 → 192.168.1.69 HTTP/JSON 143 HTTP/1.1 200 OK , JSON (application/json)
  243  85.933884 192.168.1.69 → 192.168.1.30 TCP 66 51294 → 9000 [ACK] Seq=700 Ack=6973 Win=20886 Len=0 TSval=4294942858 TSecr=145089462
  244  85.936288 192.168.1.69 → 192.168.1.30 TCP 66 51294 → 9000 [ACK] Seq=700 Ack=8421 Win=23782 Len=0 TSval=4294942858 TSecr=145089462
  245  85.942031 192.168.1.69 → 192.168.1.30 TCP 66 51294 → 9000 [ACK] Seq=700 Ack=9869 Win=26678 Len=0 TSval=4294942859 TSecr=145089462
  246  85.942031 192.168.1.69 → 192.168.1.30 TCP 66 51294 → 9000 [ACK] Seq=700 Ack=11317 Win=29574 Len=0 TSval=4294942859 TSecr=145089462
  247  85.942031 192.168.1.69 → 192.168.1.30 TCP 66 51294 → 9000 [ACK] Seq=700 Ack=12765 Win=32470 Len=0 TSval=4294942859 TSecr=145089462
  248  85.942031 192.168.1.69 → 192.168.1.30 TCP 66 51294 → 9000 [ACK] Seq=700 Ack=14213 Win=35366 Len=0 TSval=4294942859 TSecr=145089462
  249  85.943743 192.168.1.69 → 192.168.1.30 TCP 66 51294 → 9000 [ACK] Seq=700 Ack=15661 Win=35366 Len=0 TSval=4294942859 TSecr=145089462
  250  85.944922 192.168.1.69 → 192.168.1.30 TCP 66 51294 → 9000 [ACK] Seq=700 Ack=16185 Win=35366 Len=0 TSval=4294942859 TSecr=145089462
  251  85.948032 192.168.1.69 → 192.168.1.30 TCP 66 51297 → 9000 [ACK] Seq=743 Ack=404 Win=5840 Len=0 TSval=4294942859 TSecr=145089467
  252  87.687716 192.168.1.69 → 192.168.1.30 HTTP 422 POST /cometd HTTP/1.1  (text/json)
  253  87.690497 192.168.1.30 → 192.168.1.69 TCP 96 3483 → 36717 [PSH, ACK] Seq=186 Ack=773 Win=64512 Len=30 TSval=145091226 TSecr=4294942781
  254  87.697734 192.168.1.30 → 192.168.1.69 TCP 191 HTTP/1.1 200 OK 
  255  87.698355 192.168.1.30 → 192.168.1.69 TCP 145 HTTP/1.1 200 OK  [TCP PDU reassembled in 255]
  256  87.700815 192.168.1.69 → 192.168.1.30 TCP 66 51297 → 9000 [ACK] Seq=1099 Ack=529 Win=5840 Len=0 TSval=4294943035 TSecr=145091233
  257  87.700845 192.168.1.30 → 192.168.1.69 HTTP/JSON 143 HTTP/1.1 200 OK , JSON (application/json)
  258  87.701834 192.168.1.69 → 192.168.1.30 TCP 66 51294 → 9000 [ACK] Seq=700 Ack=16264 Win=35366 Len=0 TSval=4294943035 TSecr=145091233
  259  87.703871 192.168.1.69 → 192.168.1.30 TCP 66 51297 → 9000 [ACK] Seq=1099 Ack=606 Win=5840 Len=0 TSval=4294943035 TSecr=145091236
  260  87.728062 192.168.1.69 → 192.168.1.30 TCP 66 36717 → 3483 [ACK] Seq=773 Ack=216 Win=5840 Len=0 TSval=4294943038 TSecr=145091226
  261  87.728109 192.168.1.30 → 192.168.1.69 TCP 263 3483 → 36717 [PSH, ACK] Seq=216 Ack=773 Win=64512 Len=197 TSval=145091263 TSecr=4294943038
  262  87.731117 192.168.1.69 → 192.168.1.30 TCP 66 36717 → 3483 [ACK] Seq=773 Ack=413 Win=6912 Len=0 TSval=4294943038 TSecr=145091263
  263  87.795063 192.168.1.69 → 192.168.1.30 TCP 125 36717 → 3483 [PSH, ACK] Seq=773 Ack=413 Win=6912 Len=59 TSval=4294943044 TSecr=145091263
  264  87.840720 192.168.1.30 → 192.168.1.69 TCP 66 3483 → 36717 [ACK] Seq=413 Ack=832 Win=64512 Len=0 TSval=145091376 TSecr=4294943044
  265  87.942105 192.168.1.69 → 192.168.1.30 TCP 125 36717 → 3483 [PSH, ACK] Seq=832 Ack=413 Win=6912 Len=59 TSval=4294943059 TSecr=145091376 [TCP PDU reassembled in 265]
  266  87.990573 192.168.1.69 → 192.168.1.30 TCP 74 51299 → 9000 [SYN] Seq=0 Win=5840 Len=0 MSS=1460 SACK_PERM TSval=4294943064 TSecr=0 WS=2
  267  87.990820 192.168.1.30 → 192.168.1.69 TCP 74 9000 → 51299 [SYN, ACK] Seq=0 Ack=1 Win=65535 Len=0 MSS=1460 WS=256 SACK_PERM TSval=145091526 TSecr=4294943064
  268  87.993869 192.168.1.69 → 192.168.1.30 TCP 66 51299 → 9000 [ACK] Seq=1 Ack=1 Win=5840 Len=0 TSval=4294943064 TSecr=145091526
  269  87.994280 192.168.1.30 → 192.168.1.69 TCP 66 3483 → 36717 [ACK] Seq=413 Ack=891 Win=64512 Len=0 TSval=145091530 TSecr=4294943059
  270  87.999327 192.168.1.69 → 192.168.1.30 TCP 243 36717 → 3483 [PSH, ACK] Seq=891 Ack=413 Win=6912 Len=177 TSval=4294943065 TSecr=145091530 [TCP PDU reassembled in 270]
  271  88.004632 192.168.1.69 → 192.168.1.30 HTTP 119 GET /stream.mp3?player=00:04:20:26:84:ae HTTP/1.0 
  272  88.020895 192.168.1.30 → 192.168.1.69 TCP 238 HTTP/1.1 200 OK 
  273  88.028451 192.168.1.69 → 192.168.1.30 TCP 66 51299 → 9000 [ACK] Seq=54 Ack=173 Win=5840 Len=0 TSval=4294943068 TSecr=145091556
  274  88.040890 192.168.1.30 → 192.168.1.69 TCP 66 3483 → 36717 [ACK] Seq=413 Ack=1068 Win=64256 Len=0 TSval=145091576 TSecr=4294943065
  275  88.044027 192.168.1.69 → 192.168.1.30 TCP 364 36717 → 3483 [PSH, ACK] Seq=1068 Ack=413 Win=6912 Len=298 TSval=4294943069 TSecr=145091576
  276  88.087751 192.168.1.30 → 192.168.1.69 TCP 66 3483 → 36717 [ACK] Seq=413 Ack=1366 Win=64000 Len=0 TSval=145091623 TSecr=4294943069
  277  89.216155 192.168.1.30 → 192.168.1.69 TCP 4162 9000 → 51299 [PSH, ACK] Seq=173 Ack=54 Win=65280 Len=4096 TSval=145092751 TSecr=4294943068
  278  89.220057 192.168.1.30 → 192.168.1.69 TCP 1514 9000 → 51299 [ACK] Seq=4269 Ack=54 Win=65280 Len=1448 TSval=145092755 TSecr=4294943068
  279  89.237396 192.168.1.30 → 192.168.1.69 TCP 1514 [TCP Window Full] [TCP Retransmission] 9000 → 51299 [ACK] Seq=4565 Ack=54 Win=65280 Len=1448 TSval=145092773 TSecr=4294943068
  280  89.255707 192.168.1.69 → 192.168.1.30 TCP 66 51299 → 9000 [ACK] Seq=54 Ack=1621 Win=8736 Len=0 TSval=4294943190 TSecr=145092751
  281  89.255738 192.168.1.30 → 192.168.1.69 TCP 4410 [TCP Out-Of-Order] 9000 → 51299 [PSH, ACK] Seq=5717 Ack=54 Win=65280 Len=4344 TSval=145092791 TSecr=4294943190
  282  89.261106 192.168.1.69 → 192.168.1.30 TCP 66 51299 → 9000 [ACK] Seq=54 Ack=3069 Win=11632 Len=0 TSval=4294943191 TSecr=145092751
  283  89.261106 192.168.1.69 → 192.168.1.30 TCP 66 51299 → 9000 [ACK] Seq=54 Ack=4269 Win=14528 Len=0 TSval=4294943191 TSecr=145092751
  284  89.261135 192.168.1.30 → 192.168.1.69 TCP 8754 9000 → 51299 [PSH, ACK] Seq=10061 Ack=54 Win=65280 Len=8688 TSval=145092796 TSecr=4294943191
  285  89.264362 192.168.1.69 → 192.168.1.30 TCP 66 51299 → 9000 [ACK] Seq=54 Ack=5717 Win=17424 Len=0 TSval=4294943191 TSecr=145092755
  286  89.264397 192.168.1.30 → 192.168.1.69 TCP 2962 9000 → 51299 [PSH, ACK] Seq=18749 Ack=54 Win=65280 Len=2896 TSval=145092800 TSecr=4294943191
  287  89.266122 192.168.1.69 → 192.168.1.30 TCP 78 51299 → 9000 [ACK] Seq=54 Ack=6013 Win=20320 Len=0 TSval=4294943191 TSecr=145092773 SLE=4565 SRE=5717
  288  89.266122 192.168.1.69 → 192.168.1.30 TCP 78 51299 → 9000 [ACK] Seq=54 Ack=7165 Win=23216 Len=0 TSval=4294943191 TSecr=145092791 SLE=5717 SRE=6013
  289  89.266152 192.168.1.30 → 192.168.1.69 TCP 2962 9000 → 51299 [ACK] Seq=21645 Ack=54 Win=65280 Len=2896 TSval=145092801 TSecr=4294943191
  290  89.270136 192.168.1.69 → 192.168.1.30 TCP 66 51299 → 9000 [ACK] Seq=54 Ack=8613 Win=26112 Len=0 TSval=4294943192 TSecr=145092791
  291  89.270157 192.168.1.30 → 192.168.1.69 TCP 2962 9000 → 51299 [PSH, ACK] Seq=24541 Ack=54 Win=65280 Len=2896 TSval=145092805 TSecr=4294943192
  292  89.271482 192.168.1.69 → 192.168.1.30 TCP 66 51299 → 9000 [ACK] Seq=54 Ack=10061 Win=29008 Len=0 TSval=4294943192 TSecr=145092791
  293  89.271508 192.168.1.30 → 192.168.1.69 TCP 2962 9000 → 51299 [PSH, ACK] Seq=27437 Ack=54 Win=65280 Len=2896 TSval=145092807 TSecr=4294943192
  294  89.272675 192.168.1.69 → 192.168.1.30 TCP 66 51299 → 9000 [ACK] Seq=54 Ack=11509 Win=31904 Len=0 TSval=4294943192 TSecr=145092796
  295  89.272704 192.168.1.30 → 192.168.1.69 TCP 2962 9000 → 51299 [PSH, ACK] Seq=30333 Ack=54 Win=65280 Len=2896 TSval=145092808 TSecr=4294943192
  296  89.278455 192.168.1.69 → 192.168.1.30 TCP 66 51299 → 9000 [ACK] Seq=54 Ack=12957 Win=34800 Len=0 TSval=4294943192 TSecr=145092796
  297  89.278483 192.168.1.30 → 192.168.1.69 TCP 2962 9000 → 51299 [ACK] Seq=33229 Ack=54 Win=65280 Len=2896 TSval=145092814 TSecr=4294943192
  298  89.279376 192.168.1.69 → 192.168.1.30 TCP 66 51299 → 9000 [ACK] Seq=54 Ack=14405 Win=34800 Len=0 TSval=4294943192 TSecr=145092796
  299  89.279404 192.168.1.30 → 192.168.1.69 TCP 2962 9000 → 51299 [PSH, ACK] Seq=36125 Ack=54 Win=65280 Len=2896 TSval=145092815 TSecr=4294943192
  300  89.279534 192.168.1.69 → 192.168.1.30 TCP 66 51299 → 9000 [ACK] Seq=54 Ack=15853 Win=34800 Len=0 TSval=4294943192 TSecr=145092796
  301  89.279559 192.168.1.30 → 192.168.1.69 TCP 2962 9000 → 51299 [PSH, ACK] Seq=39021 Ack=54 Win=65280 Len=2896 TSval=145092815 TSecr=4294943192
  302  89.280045 192.168.1.69 → 192.168.1.30 TCP 66 51299 → 9000 [ACK] Seq=54 Ack=17301 Win=34800 Len=0 TSval=4294943193 TSecr=145092796
  303  89.280071 192.168.1.30 → 192.168.1.69 TCP 2962 9000 → 51299 [ACK] Seq=41917 Ack=54 Win=65280 Len=2896 TSval=145092815 TSecr=4294943193
  304  89.281938 192.168.1.69 → 192.168.1.30 TCP 66 51299 → 9000 [ACK] Seq=54 Ack=18749 Win=34800 Len=0 TSval=4294943193 TSecr=145092796
  305  89.281938 192.168.1.69 → 192.168.1.30 TCP 66 51299 → 9000 [ACK] Seq=54 Ack=20197 Win=34800 Len=0 TSval=4294943193 TSecr=145092800
  306  89.281972 192.168.1.30 → 192.168.1.69 TCP 5858 9000 → 51299 [PSH, ACK] Seq=44813 Ack=54 Win=65280 Len=5792 TSval=145092817 TSecr=4294943193
  307  89.283575 192.168.1.69 → 192.168.1.30 TCP 66 51299 → 9000 [ACK] Seq=54 Ack=21645 Win=34800 Len=0 TSval=4294943193 TSecr=145092800
  308  89.283602 192.168.1.30 → 192.168.1.69 TCP 2962 9000 → 51299 [PSH, ACK] Seq=50605 Ack=54 Win=65280 Len=2896 TSval=145092819 TSecr=4294943193
  309  89.285561 192.168.1.69 → 192.168.1.30 TCP 66 51299 → 9000 [ACK] Seq=54 Ack=24541 Win=34800 Len=0 TSval=4294943193 TSecr=145092801
  310  89.285589 192.168.1.30 → 192.168.1.69 TCP 5858 9000 → 51299 [PSH, ACK] Seq=53501 Ack=54 Win=65280 Len=5792 TSval=145092821 TSecr=4294943193
  311  89.288913 192.168.1.69 → 192.168.1.30 TCP 66 51299 → 9000 [ACK] Seq=54 Ack=27437 Win=34800 Len=0 TSval=4294943194 TSecr=145092805
  312  89.288942 192.168.1.30 → 192.168.1.69 TCP 2962 9000 → 51299 [PSH, ACK] Seq=59293 Ack=54 Win=65280 Len=2896 TSval=145092824 TSecr=4294943194
  313  89.328052 192.168.1.69 → 192.168.1.30 TCP 66 51299 → 9000 [ACK] Seq=54 Ack=62189 Win=48 Len=0 TSval=4294943198 TSecr=145092807
  314  89.374011 192.168.1.69 → 192.168.1.30 TCP 66 [TCP Window Update] 51299 → 9000 [ACK] Seq=54 Ack=62189 Win=34800 Len=0 TSval=4294943202 TSecr=145092807
  315  89.374047 192.168.1.30 → 192.168.1.69 TCP 34818 9000 → 51299 [PSH, ACK] Seq=62189 Ack=54 Win=65280 Len=34752 TSval=145092909 TSecr=4294943202
  316  89.381895 192.168.1.69 → 192.168.1.30 TCP 66 51299 → 9000 [ACK] Seq=54 Ack=65085 Win=34800 Len=0 TSval=4294943203 TSecr=145092909
  317  89.381925 192.168.1.30 → 192.168.1.69 TCP 2962 9000 → 51299 [ACK] Seq=96941 Ack=54 Win=65280 Len=2896 TSval=145092917 TSecr=4294943203
  318  89.385645 192.168.1.69 → 192.168.1.30 TCP 66 51299 → 9000 [ACK] Seq=54 Ack=67981 Win=34800 Len=0 TSval=4294943203 TSecr=145092909
  319  89.385689 192.168.1.30 → 192.168.1.69 TCP 2962 9000 → 51299 [ACK] Seq=99837 Ack=54 Win=65280 Len=2896 TSval=145092921 TSecr=4294943203
  320  89.386875 192.168.1.69 → 192.168.1.30 TCP 66 51299 → 9000 [ACK] Seq=54 Ack=70877 Win=34800 Len=0 TSval=4294943203 TSecr=145092909
  321  89.386918 192.168.1.30 → 192.168.1.69 TCP 2962 9000 → 51299 [ACK] Seq=102733 Ack=54 Win=65280 Len=2896 TSval=145092922 TSecr=4294943203
  322  89.389389 192.168.1.69 → 192.168.1.30 TCP 66 51299 → 9000 [ACK] Seq=54 Ack=73773 Win=34800 Len=0 TSval=4294943204 TSecr=145092909
  323  89.389417 192.168.1.30 → 192.168.1.69 TCP 2962 9000 → 51299 [ACK] Seq=105629 Ack=54 Win=65280 Len=2896 TSval=145092925 TSecr=4294943204
  324  89.391151 192.168.1.69 → 192.168.1.30 TCP 66 51299 → 9000 [ACK] Seq=54 Ack=76669 Win=34800 Len=0 TSval=4294943204 TSecr=145092909
  325  89.391195 192.168.1.30 → 192.168.1.69 TCP 2962 9000 → 51299 [PSH, ACK] Seq=108525 Ack=54 Win=65280 Len=2896 TSval=145092926 TSecr=4294943204
  326  89.394213 192.168.1.69 → 192.168.1.30 TCP 66 51299 → 9000 [ACK] Seq=54 Ack=79565 Win=34800 Len=0 TSval=4294943204 TSecr=145092909
  327  89.394244 192.168.1.30 → 192.168.1.69 TCP 2962 9000 → 51299 [ACK] Seq=111421 Ack=54 Win=65280 Len=2896 TSval=145092930 TSecr=4294943204
  328  89.397497 192.168.1.69 → 192.168.1.30 TCP 66 51299 → 9000 [ACK] Seq=54 Ack=82461 Win=34800 Len=0 TSval=4294943204 TSecr=145092909
  329  89.397536 192.168.1.30 → 192.168.1.69 TCP 2962 9000 → 51299 [PSH, ACK] Seq=114317 Ack=54 Win=65280 Len=2896 TSval=145092933 TSecr=4294943204
  330  89.398868 192.168.1.69 → 192.168.1.30 TCP 66 51299 → 9000 [ACK] Seq=54 Ack=85357 Win=34800 Len=0 TSval=4294943205 TSecr=145092909
  331  89.398896 192.168.1.30 → 192.168.1.69 TCP 2962 9000 → 51299 [PSH, ACK] Seq=117213 Ack=54 Win=65280 Len=2896 TSval=145092934 TSecr=4294943205
  332  89.403380 192.168.1.69 → 192.168.1.30 TCP 66 51299 → 9000 [ACK] Seq=54 Ack=88253 Win=34800 Len=0 TSval=4294943205 TSecr=145092909
  333  89.403424 192.168.1.30 → 192.168.1.69 TCP 2962 9000 → 51299 [ACK] Seq=120109 Ack=54 Win=65280 Len=2896 TSval=145092939 TSecr=4294943205
  334  89.403589 192.168.1.30 → 192.168.1.69 TCP 114 [TCP Window Full] 9000 → 51299 [PSH, ACK] Seq=123005 Ack=54 Win=65280 Len=48 TSval=145092939 TSecr=4294943205
  335  89.404840 192.168.1.69 → 192.168.1.30 TCP 66 51299 → 9000 [ACK] Seq=54 Ack=91149 Win=34800 Len=0 TSval=4294943205 TSecr=145092909
  336  89.404895 192.168.1.30 → 192.168.1.69 TCP 2962 [TCP Window Full] 9000 → 51299 [ACK] Seq=123053 Ack=54 Win=65280 Len=2896 TSval=145092940 TSecr=4294943205
  337  89.428704 192.168.1.69 → 192.168.1.30 TCP 66 51299 → 9000 [ACK] Seq=54 Ack=124501 Win=1448 Len=0 TSval=4294943208 TSecr=145092909
  338  89.468094 192.168.1.69 → 192.168.1.30 TCP 66 [TCP ZeroWindow] 51299 → 9000 [ACK] Seq=54 Ack=125949 Win=0 Len=0 TSval=4294943212 TSecr=145092940
  339  89.512391 192.168.1.69 → 192.168.1.30 TCP 66 [TCP Window Update] 51299 → 9000 [ACK] Seq=54 Ack=125949 Win=34800 Len=0 TSval=4294943216 TSecr=145092940
  340  89.512432 192.168.1.30 → 192.168.1.69 TCP 34818 9000 → 51299 [PSH, ACK] Seq=125949 Ack=54 Win=65280 Len=34752 TSval=145093048 TSecr=4294943216
  341  89.523292 192.168.1.69 → 192.168.1.30 TCP 66 51299 → 9000 [ACK] Seq=54 Ack=128845 Win=34800 Len=0 TSval=4294943217 TSecr=145093048
  342  89.523346 192.168.1.30 → 192.168.1.69 TCP 2962 9000 → 51299 [ACK] Seq=160701 Ack=54 Win=65280 Len=2896 TSval=145093059 TSecr=4294943217
  343  89.525554 192.168.1.69 → 192.168.1.30 TCP 66 51299 → 9000 [ACK] Seq=54 Ack=131741 Win=34800 Len=0 TSval=4294943217 TSecr=145093048
  344  89.525554 192.168.1.69 → 192.168.1.30 TCP 66 51299 → 9000 [ACK] Seq=54 Ack=134637 Win=34800 Len=0 TSval=4294943217 TSecr=145093048
  345  89.525605 192.168.1.30 → 192.168.1.69 TCP 5858 9000 → 51299 [PSH, ACK] Seq=163597 Ack=54 Win=65280 Len=5792 TSval=145093061 TSecr=4294943217
  346  89.529644 192.168.1.69 → 192.168.1.30 TCP 66 51299 → 9000 [ACK] Seq=54 Ack=137533 Win=34800 Len=0 TSval=4294943218 TSecr=145093048
  347  89.529673 192.168.1.30 → 192.168.1.69 TCP 2962 9000 → 51299 [PSH, ACK] Seq=169389 Ack=54 Win=65280 Len=2896 TSval=145093065 TSecr=4294943218
  348  89.532484 192.168.1.69 → 192.168.1.30 TCP 66 51299 → 9000 [ACK] Seq=54 Ack=140429 Win=34800 Len=0 TSval=4294943218 TSecr=145093048
  349  89.532517 192.168.1.30 → 192.168.1.69 TCP 2962 9000 → 51299 [ACK] Seq=172285 Ack=54 Win=65280 Len=2896 TSval=145093068 TSecr=4294943218
  350  89.534103 192.168.1.69 → 192.168.1.30 TCP 66 51299 → 9000 [ACK] Seq=54 Ack=143325 Win=34800 Len=0 TSval=4294943218 TSecr=145093048
  351  89.534135 192.168.1.30 → 192.168.1.69 TCP 2962 9000 → 51299 [PSH, ACK] Seq=175181 Ack=54 Win=65280 Len=2896 TSval=145093069 TSecr=4294943218
  352  89.535935 192.168.1.69 → 192.168.1.30 TCP 66 51299 → 9000 [ACK] Seq=54 Ack=146221 Win=34800 Len=0 TSval=4294943218 TSecr=145093048
  353  89.535964 192.168.1.30 → 192.168.1.69 TCP 2962 9000 → 51299 [PSH, ACK] Seq=178077 Ack=54 Win=65280 Len=2896 TSval=145093071 TSecr=4294943218
  354  89.542544 192.168.1.69 → 192.168.1.30 TCP 66 51299 → 9000 [ACK] Seq=54 Ack=149117 Win=34800 Len=0 TSval=4294943219 TSecr=145093048
  355  89.542577 192.168.1.30 → 192.168.1.69 TCP 2962 9000 → 51299 [ACK] Seq=180973 Ack=54 Win=65280 Len=2896 TSval=145093078 TSecr=4294943219
  356  89.544147 192.168.1.69 → 192.168.1.30 TCP 66 51299 → 9000 [ACK] Seq=54 Ack=152013 Win=34800 Len=0 TSval=4294943219 TSecr=145093048
  357  89.544177 192.168.1.30 → 192.168.1.69 TCP 2962 9000 → 51299 [ACK] Seq=183869 Ack=54 Win=65280 Len=2896 TSval=145093079 TSecr=4294943219
  358  89.546975 192.168.1.69 → 192.168.1.30 TCP 66 51299 → 9000 [ACK] Seq=54 Ack=154909 Win=34800 Len=0 TSval=4294943219 TSecr=145093048
  359  89.546999 192.168.1.30 → 192.168.1.69 TCP 2962 9000 → 51299 [ACK] Seq=186765 Ack=54 Win=65280 Len=2896 TSval=145093082 TSecr=4294943219
  360  89.567221 192.168.1.30 → 192.168.1.69 TCP 66 9000 → 51298 [FIN, ACK] Seq=1592 Ack=141 Win=65280 Len=0 TSval=145093102 TSecr=4294942722
  361  89.568648 192.168.1.69 → 192.168.1.30 TCP 66 51299 → 9000 [ACK] Seq=54 Ack=185317 Win=4528 Len=0 TSval=4294943222 TSecr=145093048
  362  89.608527 192.168.1.69 → 192.168.1.30 TCP 66 51299 → 9000 [ACK] Seq=54 Ack=189661 Win=184 Len=0 TSval=4294943226 TSecr=145093079
  363  89.608539 192.168.1.69 → 192.168.1.30 TCP 66 51298 → 9000 [ACK] Seq=141 Ack=1593 Win=9692 Len=0 TSval=4294943226 TSecr=145093102
  364  89.684829 192.168.1.69 → 192.168.1.30 TCP 66 51298 → 9000 [FIN, ACK] Seq=141 Ack=1593 Win=9692 Len=0 TSval=4294943233 TSecr=145093102
  365  89.684931 192.168.1.30 → 192.168.1.69 TCP 66 9000 → 51298 [ACK] Seq=1593 Ack=142 Win=65280 Len=0 TSval=145093220 TSecr=4294943233
  366  89.800131 192.168.1.69 → 192.168.1.30 TCP 66 [TCP Window Update] 51299 → 9000 [ACK] Seq=54 Ack=189661 Win=34800 Len=0 TSval=4294943244 TSecr=145093079
  367  89.800186 192.168.1.30 → 192.168.1.69 MPEG-1 11616 Audio Layer 3, 128 kb/s, 44,1 kHz
  368  89.807078 192.168.1.69 → 192.168.1.30 TCP 66 51299 → 9000 [ACK] Seq=54 Ack=191109 Win=34800 Len=0 TSval=4294943245 TSecr=145093335
  369  89.809012 192.168.1.69 → 192.168.1.30 TCP 66 51299 → 9000 [ACK] Seq=54 Ack=192557 Win=34800 Len=0 TSval=4294943246 TSecr=145093335
  370  89.810487 192.168.1.69 → 192.168.1.30 TCP 66 51299 → 9000 [ACK] Seq=54 Ack=194005 Win=34800 Len=0 TSval=4294943246 TSecr=145093335
  371  89.811503 192.168.1.69 → 192.168.1.30 TCP 66 51299 → 9000 [ACK] Seq=54 Ack=195453 Win=34800 Len=0 TSval=4294943246 TSecr=145093335
  372  89.812774 192.168.1.69 → 192.168.1.30 TCP 66 51299 → 9000 [ACK] Seq=54 Ack=196901 Win=34800 Len=0 TSval=4294943246 TSecr=145093335
  373  89.814189 192.168.1.69 → 192.168.1.30 TCP 66 51299 → 9000 [ACK] Seq=54 Ack=198349 Win=34800 Len=0 TSval=4294943246 TSecr=145093335
  374  89.815450 192.168.1.69 → 192.168.1.30 TCP 66 51299 → 9000 [ACK] Seq=54 Ack=199797 Win=34800 Len=0 TSval=4294943246 TSecr=145093335
  375  89.819502 192.168.1.69 → 192.168.1.30 TCP 125 36717 → 3483 [PSH, ACK] Seq=1366 Ack=413 Win=6912 Len=59 TSval=4294943247 TSecr=145091623
  376  89.858099 192.168.1.69 → 192.168.1.30 TCP 66 51299 → 9000 [ACK] Seq=54 Ack=201212 Win=34800 Len=0 TSval=4294943251 TSecr=145093335
  377  89.862259 192.168.1.30 → 192.168.1.69 TCP 66 3483 → 36717 [ACK] Seq=413 Ack=1425 Win=64000 Len=0 TSval=145093398 TSecr=4294943247
  378  89.954250 192.168.1.69 → 192.168.1.30 TCP 66 51299 → 9000 [FIN, ACK] Seq=54 Ack=201212 Win=34800 Len=0 TSval=4294943260 TSecr=145093335
  379  89.954326 192.168.1.30 → 192.168.1.69 TCP 66 9000 → 51299 [ACK] Seq=201212 Ack=55 Win=65280 Len=0 TSval=145093490 TSecr=4294943260
  380  89.971864 192.168.1.69 → 192.168.1.30 TCP 75 36717 → 3483 [PSH, ACK] Seq=1425 Ack=413 Win=6912 Len=9 TSval=4294943262 TSecr=145093398 [TCP PDU reassembled in 380]
  381  90.018090 192.168.1.30 → 192.168.1.69 TCP 66 3483 → 36717 [ACK] Seq=413 Ack=1434 Win=64000 Len=0 TSval=145093553 TSecr=4294943262
  382  90.144690 192.168.1.30 → 192.168.1.69 TCP 96 3483 → 36717 [PSH, ACK] Seq=413 Ack=1434 Win=64000 Len=30 TSval=145093680 TSecr=4294943262
  383  90.160186 192.168.1.69 → 192.168.1.30 TCP 66 36717 → 3483 [ACK] Seq=1434 Ack=443 Win=6912 Len=0 TSval=4294943280 TSecr=145093680
  384  90.160186 192.168.1.69 → 192.168.1.30 TCP 125 36717 → 3483 [PSH, ACK] Seq=1434 Ack=443 Win=6912 Len=59 TSval=4294943281 TSecr=145093680
  385  90.205510 192.168.1.30 → 192.168.1.69 TCP 66 3483 → 36717 [ACK] Seq=443 Ack=1493 Win=65280 Len=0 TSval=145093741 TSecr=4294943281
  386  90.215502 192.168.1.69 → 192.168.1.30 TCP 125 36717 → 3483 [PSH, ACK] Seq=1493 Ack=443 Win=6912 Len=59 TSval=4294943286 TSecr=145093741
  387  90.267532 192.168.1.30 → 192.168.1.69 TCP 66 3483 → 36717 [ACK] Seq=443 Ack=1552 Win=65280 Len=0 TSval=145093803 TSecr=4294943286
  388  91.272838 192.168.1.69 → 192.168.1.30 TCP 125 36717 → 3483 [PSH, ACK] Seq=1552 Ack=443 Win=6912 Len=59 TSval=4294943392 TSecr=145093803
  389  91.323631 192.168.1.30 → 192.168.1.69 TCP 66 3483 → 36717 [ACK] Seq=443 Ack=1611 Win=65280 Len=0 TSval=145094859 TSecr=4294943392
  390  92.207129 192.168.1.69 → 192.168.1.30 HTTP 390 POST /cometd HTTP/1.1  (text/json)
  391  92.208602 192.168.1.30 → 192.168.1.69 TCP 94 3483 → 36717 [PSH, ACK] Seq=443 Ack=1611 Win=65280 Len=28 TSval=145095744 TSecr=4294943392
  392  92.209818 192.168.1.30 → 192.168.1.69 TCP 191 HTTP/1.1 200 OK 
  393  92.210248 192.168.1.30 → 192.168.1.69 TCP 148 HTTP/1.1 200 OK  [TCP PDU reassembled in 393]
  394  92.212823 192.168.1.69 → 192.168.1.30 TCP 66 51297 → 9000 [ACK] Seq=1423 Ack=731 Win=5840 Len=0 TSval=4294943486 TSecr=145095745
  395  92.212858 192.168.1.30 → 192.168.1.69 HTTP/JSON 143 HTTP/1.1 200 OK , JSON (application/json)
  396  92.214480 192.168.1.69 → 192.168.1.30 TCP 66 51294 → 9000 [ACK] Seq=700 Ack=16346 Win=35366 Len=0 TSval=4294943486 TSecr=145095746
  397  92.217973 192.168.1.69 → 192.168.1.30 TCP 66 51297 → 9000 [ACK] Seq=1423 Ack=808 Win=5840 Len=0 TSval=4294943486 TSecr=145095748
  398  92.248244 192.168.1.69 → 192.168.1.30 TCP 66 36717 → 3483 [ACK] Seq=1611 Ack=471 Win=6912 Len=0 TSval=4294943490 TSecr=145095744
  399  92.623059 192.168.1.69 → 192.168.1.30 HTTP 390 POST /cometd HTTP/1.1  (text/json)
  400  92.624474 192.168.1.30 → 192.168.1.69 TCP 94 3483 → 36717 [PSH, ACK] Seq=471 Ack=1611 Win=65280 Len=28 TSval=145096160 TSecr=4294943490
  401  92.625285 192.168.1.30 → 192.168.1.69 TCP 191 HTTP/1.1 200 OK 
  402  92.625823 192.168.1.30 → 192.168.1.69 TCP 148 HTTP/1.1 200 OK  [TCP PDU reassembled in 402]
  403  92.629131 192.168.1.69 → 192.168.1.30 TCP 66 36717 → 3483 [ACK] Seq=1611 Ack=499 Win=6912 Len=0 TSval=4294943528 TSecr=145096160
  404  92.633099 192.168.1.69 → 192.168.1.30 TCP 66 51297 → 9000 [ACK] Seq=1747 Ack=933 Win=5840 Len=0 TSval=4294943528 TSecr=145096161
  405  92.633112 192.168.1.69 → 192.168.1.30 TCP 66 51294 → 9000 [ACK] Seq=700 Ack=16428 Win=35366 Len=0 TSval=4294943528 TSecr=145096161
  406  92.633128 192.168.1.30 → 192.168.1.69 HTTP/JSON 143 HTTP/1.1 200 OK , JSON (application/json)
  407  92.637731 192.168.1.69 → 192.168.1.30 TCP 66 51297 → 9000 [ACK] Seq=1747 Ack=1010 Win=5840 Len=0 TSval=4294943528 TSecr=145096168
  408  92.641570 192.168.1.69 → 192.168.1.30 TCP 184 36717 → 3483 [PSH, ACK] Seq=1611 Ack=499 Win=6912 Len=118 TSval=4294943529 TSecr=145096160 [TCP PDU reassembled in 408]
  409  92.691193 192.168.1.30 → 192.168.1.69 TCP 66 3483 → 36717 [ACK] Seq=499 Ack=1729 Win=65280 Len=0 TSval=145096226 TSecr=4294943529
  410  92.694266 192.168.1.69 → 192.168.1.30 TCP 125 36717 → 3483 [PSH, ACK] Seq=1729 Ack=499 Win=6912 Len=59 TSval=4294943534 TSecr=145096226
  411  92.731446 192.168.1.69 → 192.168.1.30 HTTP 390 POST /cometd HTTP/1.1  (text/json)
  412  92.732966 192.168.1.30 → 192.168.1.69 TCP 94 3483 → 36717 [PSH, ACK] Seq=499 Ack=1788 Win=65024 Len=28 TSval=145096268 TSecr=4294943534
  413  92.733630 192.168.1.30 → 192.168.1.69 TCP 191 HTTP/1.1 200 OK 
  414  92.734014 192.168.1.30 → 192.168.1.69 TCP 148 HTTP/1.1 200 OK  [TCP PDU reassembled in 414]
  415  92.739292 192.168.1.69 → 192.168.1.30 TCP 66 51297 → 9000 [ACK] Seq=2071 Ack=1135 Win=5840 Len=0 TSval=4294943539 TSecr=145096269
  416  92.739327 192.168.1.30 → 192.168.1.69 HTTP/JSON 143 HTTP/1.1 200 OK , JSON (application/json)
  417  92.740124 192.168.1.69 → 192.168.1.30 TCP 66 51294 → 9000 [ACK] Seq=700 Ack=16510 Win=35366 Len=0 TSval=4294943539 TSecr=145096269
  418  92.742417 192.168.1.69 → 192.168.1.30 TCP 66 51297 → 9000 [ACK] Seq=2071 Ack=1212 Win=5840 Len=0 TSval=4294943539 TSecr=145096275
  419  92.761516 192.168.1.69 → 192.168.1.30 TCP 125 36717 → 3483 [PSH, ACK] Seq=1788 Ack=527 Win=6912 Len=59 TSval=4294943541 TSecr=145096268
  420  92.816628 192.168.1.30 → 192.168.1.69 TCP 66 3483 → 36717 [ACK] Seq=527 Ack=1847 Win=65024 Len=0 TSval=145096352 TSecr=4294943541
  421  93.234690 192.168.1.69 → 192.168.1.30 HTTP 390 POST /cometd HTTP/1.1  (text/json)
  422  93.236125 192.168.1.30 → 192.168.1.69 TCP 94 3483 → 36717 [PSH, ACK] Seq=527 Ack=1847 Win=65024 Len=28 TSval=145096771 TSecr=4294943541
  423  93.236969 192.168.1.30 → 192.168.1.69 TCP 191 HTTP/1.1 200 OK 
  424  93.237550 192.168.1.30 → 192.168.1.69 TCP 148 HTTP/1.1 200 OK  [TCP PDU reassembled in 424]
  425  93.242234 192.168.1.69 → 192.168.1.30 TCP 66 51294 → 9000 [ACK] Seq=700 Ack=16592 Win=35366 Len=0 TSval=4294943589 TSecr=145096773
  426  93.243287 192.168.1.69 → 192.168.1.30 TCP 66 51297 → 9000 [ACK] Seq=2395 Ack=1337 Win=5840 Len=0 TSval=4294943589 TSecr=145096772
  427  93.243323 192.168.1.30 → 192.168.1.69 HTTP/JSON 143 HTTP/1.1 200 OK , JSON (application/json)
  428  93.248764 192.168.1.69 → 192.168.1.30 TCP 66 51297 → 9000 [ACK] Seq=2395 Ack=1414 Win=5840 Len=0 TSval=4294943590 TSecr=145096779
  429  93.278353 192.168.1.69 → 192.168.1.30 TCP 66 36717 → 3483 [ACK] Seq=1847 Ack=555 Win=6912 Len=0 TSval=4294943593 TSecr=145096771
  430  93.313252 192.168.1.69 → 192.168.1.30 TCP 125 36717 → 3483 [PSH, ACK] Seq=1847 Ack=555 Win=6912 Len=59 TSval=4294943596 TSecr=145096771
  431  93.360436 192.168.1.30 → 192.168.1.69 TCP 66 3483 → 36717 [ACK] Seq=555 Ack=1906 Win=65024 Len=0 TSval=145096896 TSecr=4294943596
  432  93.525084 192.168.1.69 → 192.168.1.30 HTTP 390 POST /cometd HTTP/1.1  (text/json)
  433  93.526743 192.168.1.30 → 192.168.1.69 TCP 94 3483 → 36717 [PSH, ACK] Seq=555 Ack=1906 Win=65024 Len=28 TSval=145097062 TSecr=4294943596
  434  93.527386 192.168.1.30 → 192.168.1.69 TCP 191 HTTP/1.1 200 OK 
  435  93.527763 192.168.1.30 → 192.168.1.69 TCP 148 HTTP/1.1 200 OK  [TCP PDU reassembled in 435]
  436  93.529510 192.168.1.69 → 192.168.1.30 TCP 66 36717 → 3483 [ACK] Seq=1906 Ack=583 Win=6912 Len=0 TSval=4294943618 TSecr=145097062
  437  93.531487 192.168.1.69 → 192.168.1.30 TCP 66 51297 → 9000 [ACK] Seq=2719 Ack=1539 Win=5840 Len=0 TSval=4294943618 TSecr=145097063
  438  93.531516 192.168.1.30 → 192.168.1.69 HTTP/JSON 143 HTTP/1.1 200 OK , JSON (application/json)
  439  93.532518 192.168.1.69 → 192.168.1.30 TCP 66 51294 → 9000 [ACK] Seq=700 Ack=16674 Win=35366 Len=0 TSval=4294943618 TSecr=145097063
  440  93.535079 192.168.1.69 → 192.168.1.30 TCP 66 51297 → 9000 [ACK] Seq=2719 Ack=1616 Win=5840 Len=0 TSval=4294943618 TSecr=145097067
  441  93.605330 192.168.1.69 → 192.168.1.30 TCP 125 36717 → 3483 [PSH, ACK] Seq=1906 Ack=583 Win=6912 Len=59 TSval=4294943625 TSecr=145097062
  442  93.656581 192.168.1.30 → 192.168.1.69 TCP 66 3483 → 36717 [ACK] Seq=583 Ack=1965 Win=65024 Len=0 TSval=145097192 TSecr=4294943625
  443  93.669053 192.168.1.69 → 192.168.1.30 TCP 125 36717 → 3483 [PSH, ACK] Seq=1965 Ack=583 Win=6912 Len=59 TSval=4294943632 TSecr=145097192
  444  93.719192 192.168.1.30 → 192.168.1.69 TCP 66 3483 → 36717 [ACK] Seq=583 Ack=2024 Win=64768 Len=0 TSval=145097254 TSecr=4294943632
  445  93.725285 192.168.1.69 → 192.168.1.30 HTTP 391 POST /cometd HTTP/1.1  (text/json)
  446  93.726818 192.168.1.30 → 192.168.1.69 TCP 94 3483 → 36717 [PSH, ACK] Seq=583 Ack=2024 Win=64768 Len=28 TSval=145097262 TSecr=4294943632
  447  93.727752 192.168.1.30 → 192.168.1.69 TCP 191 HTTP/1.1 200 OK 
  448  93.728199 192.168.1.30 → 192.168.1.69 TCP 148 HTTP/1.1 200 OK  [TCP PDU reassembled in 448]
  449  93.729609 192.168.1.69 → 192.168.1.30 TCP 66 36717 → 3483 [ACK] Seq=2024 Ack=611 Win=6912 Len=0 TSval=4294943638 TSecr=145097262
  450  93.731410 192.168.1.69 → 192.168.1.30 TCP 66 51297 → 9000 [ACK] Seq=3044 Ack=1741 Win=5840 Len=0 TSval=4294943638 TSecr=145097263
  451  93.731438 192.168.1.30 → 192.168.1.69 HTTP/JSON 143 HTTP/1.1 200 OK , JSON (application/json)
  452  93.732728 192.168.1.69 → 192.168.1.30 TCP 66 51294 → 9000 [ACK] Seq=700 Ack=16756 Win=35366 Len=0 TSval=4294943638 TSecr=145097263
  453  93.734871 192.168.1.69 → 192.168.1.30 TCP 66 51297 → 9000 [ACK] Seq=3044 Ack=1818 Win=5840 Len=0 TSval=4294943638 TSecr=145097267
  454  93.809272 192.168.1.69 → 192.168.1.30 TCP 125 36717 → 3483 [PSH, ACK] Seq=2024 Ack=611 Win=6912 Len=59 TSval=4294943645 TSecr=145097262 [TCP PDU reassembled in 454]
  455  93.858543 192.168.1.30 → 192.168.1.69 TCP 66 3483 → 36717 [ACK] Seq=611 Ack=2083 Win=64768 Len=0 TSval=145097394 TSecr=4294943645
  456  93.921429 192.168.1.69 → 192.168.1.30 HTTP 391 POST /cometd HTTP/1.1  (text/json)
  457  93.922953 192.168.1.30 → 192.168.1.69 TCP 94 3483 → 36717 [PSH, ACK] Seq=611 Ack=2083 Win=64768 Len=28 TSval=145097458 TSecr=4294943645
  458  93.923916 192.168.1.30 → 192.168.1.69 TCP 191 HTTP/1.1 200 OK 
  459  93.924428 192.168.1.30 → 192.168.1.69 TCP 148 HTTP/1.1 200 OK  [TCP PDU reassembled in 459]
  460  93.927556 192.168.1.69 → 192.168.1.30 TCP 66 36717 → 3483 [ACK] Seq=2083 Ack=639 Win=6912 Len=0 TSval=4294943657 TSecr=145097458
  461  93.930377 192.168.1.69 → 192.168.1.30 TCP 66 51294 → 9000 [ACK] Seq=700 Ack=16838 Win=35366 Len=0 TSval=4294943658 TSecr=145097460
  462  93.932904 192.168.1.69 → 192.168.1.30 TCP 66 51297 → 9000 [ACK] Seq=3369 Ack=1943 Win=5840 Len=0 TSval=4294943658 TSecr=145097459
  463  93.933015 192.168.1.30 → 192.168.1.69 HTTP/JSON 143 HTTP/1.1 200 OK , JSON (application/json)
  464  93.961174 192.168.1.69 → 192.168.1.30 TCP 66 51297 → 9000 [ACK] Seq=3369 Ack=2020 Win=5840 Len=0 TSval=4294943660 TSecr=145097468
  465  93.962022 192.168.1.69 → 192.168.1.30 TCP 125 36717 → 3483 [PSH, ACK] Seq=2083 Ack=639 Win=6912 Len=59 TSval=4294943660 TSecr=145097458 [TCP PDU reassembled in 465]
  466  94.013943 192.168.1.30 → 192.168.1.69 TCP 66 3483 → 36717 [ACK] Seq=639 Ack=2142 Win=64768 Len=0 TSval=145097549 TSecr=4294943660
  467  94.675934 192.168.1.69 → 192.168.1.30 TCP 125 36717 → 3483 [PSH, ACK] Seq=2142 Ack=639 Win=6912 Len=59 TSval=4294943732 TSecr=145097549 [TCP PDU reassembled in 467]
  468  94.729838 192.168.1.30 → 192.168.1.69 TCP 66 3483 → 36717 [ACK] Seq=639 Ack=2201 Win=64768 Len=0 TSval=145098265 TSecr=4294943732
  469  95.152512 192.168.1.30 → 192.168.1.69 TCP 96 3483 → 36717 [PSH, ACK] Seq=639 Ack=2201 Win=64768 Len=30 TSval=145098688 TSecr=4294943732
  470  95.203689 192.168.1.69 → 192.168.1.30 TCP 125 36717 → 3483 [PSH, ACK] Seq=2201 Ack=669 Win=6912 Len=59 TSval=4294943785 TSecr=145098688 [TCP PDU reassembled in 470]
  471  95.225224 192.168.1.69 → 192.168.1.30 HTTP 391 POST /cometd HTTP/1.1  (text/json)
  472  95.226412 192.168.1.30 → 192.168.1.69 TCP 94 3483 → 36717 [PSH, ACK] Seq=669 Ack=2260 Win=64768 Len=28 TSval=145098762 TSecr=4294943785
  473  95.227559 192.168.1.30 → 192.168.1.69 TCP 191 HTTP/1.1 200 OK 
  474  95.228053 192.168.1.30 → 192.168.1.69 TCP 148 HTTP/1.1 200 OK  [TCP PDU reassembled in 474]
  475  95.230813 192.168.1.69 → 192.168.1.30 TCP 66 51297 → 9000 [ACK] Seq=3694 Ack=2145 Win=5840 Len=0 TSval=4294943788 TSecr=145098763
  476  95.230845 192.168.1.30 → 192.168.1.69 HTTP/JSON 143 HTTP/1.1 200 OK , JSON (application/json)
  477  95.232061 192.168.1.69 → 192.168.1.30 TCP 66 51294 → 9000 [ACK] Seq=700 Ack=16920 Win=35366 Len=0 TSval=4294943788 TSecr=145098763
  478  95.233658 192.168.1.69 → 192.168.1.30 TCP 66 51297 → 9000 [ACK] Seq=3694 Ack=2222 Win=5840 Len=0 TSval=4294943788 TSecr=145098766
  479  95.268436 192.168.1.69 → 192.168.1.30 TCP 66 36717 → 3483 [ACK] Seq=2260 Ack=697 Win=6912 Len=0 TSval=4294943792 TSecr=145098762
  480  95.314318 192.168.1.69 → 192.168.1.30 TCP 125 36717 → 3483 [PSH, ACK] Seq=2260 Ack=697 Win=6912 Len=59 TSval=4294943796 TSecr=145098762 [TCP PDU reassembled in 480]
  481  95.367817 192.168.1.30 → 192.168.1.69 TCP 66 3483 → 36717 [ACK] Seq=697 Ack=2319 Win=64512 Len=0 TSval=145098903 TSecr=4294943796
  482  95.420767 192.168.1.69 → 192.168.1.30 HTTP 391 POST /cometd HTTP/1.1  (text/json)
  483  95.422245 192.168.1.30 → 192.168.1.69 TCP 94 3483 → 36717 [PSH, ACK] Seq=697 Ack=2319 Win=64512 Len=28 TSval=145098958 TSecr=4294943796
  484  95.423163 192.168.1.30 → 192.168.1.69 TCP 191 HTTP/1.1 200 OK 
  485  95.423621 192.168.1.30 → 192.168.1.69 TCP 148 HTTP/1.1 200 OK  [TCP PDU reassembled in 485]
  486  95.425114 192.168.1.69 → 192.168.1.30 TCP 66 36717 → 3483 [ACK] Seq=2319 Ack=725 Win=6912 Len=0 TSval=4294943807 TSecr=145098958
  487  95.428737 192.168.1.69 → 192.168.1.30 TCP 66 51297 → 9000 [ACK] Seq=4019 Ack=2347 Win=5840 Len=0 TSval=4294943808 TSecr=145098958
  488  95.428772 192.168.1.30 → 192.168.1.69 HTTP/JSON 143 HTTP/1.1 200 OK , JSON (application/json)
  489  95.430144 192.168.1.69 → 192.168.1.30 TCP 66 51294 → 9000 [ACK] Seq=700 Ack=17002 Win=35366 Len=0 TSval=4294943808 TSecr=145098958
  490  95.431576 192.168.1.69 → 192.168.1.30 TCP 66 51297 → 9000 [ACK] Seq=4019 Ack=2424 Win=5840 Len=0 TSval=4294943808 TSecr=145098964
  491  95.502705 192.168.1.69 → 192.168.1.30 TCP 125 36717 → 3483 [PSH, ACK] Seq=2319 Ack=725 Win=6912 Len=59 TSval=4294943815 TSecr=145098958 [TCP PDU reassembled in 491]
  492  95.553893 192.168.1.30 → 192.168.1.69 TCP 66 3483 → 36717 [ACK] Seq=725 Ack=2378 Win=64512 Len=0 TSval=145099089 TSecr=4294943815
  493  95.609833 192.168.1.69 → 192.168.1.30 HTTP 391 POST /cometd HTTP/1.1  (text/json)
  494  95.611390 192.168.1.30 → 192.168.1.69 TCP 94 3483 → 36717 [PSH, ACK] Seq=725 Ack=2378 Win=64512 Len=28 TSval=145099147 TSecr=4294943815
  495  95.612359 192.168.1.30 → 192.168.1.69 TCP 191 HTTP/1.1 200 OK 
  496  95.612880 192.168.1.30 → 192.168.1.69 TCP 148 HTTP/1.1 200 OK  [TCP PDU reassembled in 496]
  497  95.616051 192.168.1.69 → 192.168.1.30 TCP 66 36717 → 3483 [ACK] Seq=2378 Ack=753 Win=6912 Len=0 TSval=4294943826 TSecr=145099147
  498  95.618624 192.168.1.69 → 192.168.1.30 TCP 66 51294 → 9000 [ACK] Seq=700 Ack=17084 Win=35366 Len=0 TSval=4294943827 TSecr=145099148
  499  95.621514 192.168.1.69 → 192.168.1.30 TCP 66 51297 → 9000 [ACK] Seq=4344 Ack=2549 Win=5840 Len=0 TSval=4294943827 TSecr=145099148
  500  95.621550 192.168.1.30 → 192.168.1.69 HTTP/JSON 143 HTTP/1.1 200 OK , JSON (application/json)
  501  95.632442 192.168.1.69 → 192.168.1.30 TCP 66 51297 → 9000 [ACK] Seq=4344 Ack=2626 Win=5840 Len=0 TSval=4294943828 TSecr=145099157
  502  95.648190 192.168.1.69 → 192.168.1.30 TCP 125 36717 → 3483 [PSH, ACK] Seq=2378 Ack=753 Win=6912 Len=59 TSval=4294943829 TSecr=145099147 [TCP PDU reassembled in 502]
  503  95.694021 192.168.1.30 → 192.168.1.69 TCP 66 3483 → 36717 [ACK] Seq=753 Ack=2437 Win=64512 Len=0 TSval=145099229 TSecr=4294943829
  504  95.711330 192.168.1.69 → 192.168.1.30 TCP 125 36717 → 3483 [PSH, ACK] Seq=2437 Ack=753 Win=6912 Len=59 TSval=4294943836 TSecr=145099229 [TCP PDU reassembled in 504]
  505  95.757767 192.168.1.30 → 192.168.1.69 TCP 66 3483 → 36717 [ACK] Seq=753 Ack=2496 Win=64512 Len=0 TSval=145099293 TSecr=4294943836
  506  96.696405 192.168.1.69 → 192.168.1.30 HTTP 391 POST /cometd HTTP/1.1  (text/json)
  507  96.697686 192.168.1.30 → 192.168.1.69 TCP 94 3483 → 36717 [PSH, ACK] Seq=753 Ack=2496 Win=64512 Len=28 TSval=145100233 TSecr=4294943836
  508  96.698355 192.168.1.30 → 192.168.1.69 TCP 191 HTTP/1.1 200 OK 
  509  96.698758 192.168.1.30 → 192.168.1.69 TCP 148 HTTP/1.1 200 OK  [TCP PDU reassembled in 509]
  510  96.704529 192.168.1.69 → 192.168.1.30 TCP 66 51294 → 9000 [ACK] Seq=700 Ack=17166 Win=35366 Len=0 TSval=4294943935 TSecr=145100234
  511  96.704587 192.168.1.69 → 192.168.1.30 TCP 66 51297 → 9000 [ACK] Seq=4669 Ack=2751 Win=5840 Len=0 TSval=4294943935 TSecr=145100234
  512  96.704620 192.168.1.30 → 192.168.1.69 HTTP/JSON 143 HTTP/1.1 200 OK , JSON (application/json)
  513  96.709249 192.168.1.69 → 192.168.1.30 TCP 66 51297 → 9000 [ACK] Seq=4669 Ack=2828 Win=5840 Len=0 TSval=4294943936 TSecr=145100240
  514  96.738532 192.168.1.69 → 192.168.1.30 TCP 66 36717 → 3483 [ACK] Seq=2496 Ack=781 Win=6912 Len=0 TSval=4294943939 TSecr=145100233
  515  96.843468 192.168.1.69 → 192.168.1.30 TCP 184 36717 → 3483 [PSH, ACK] Seq=2496 Ack=781 Win=6912 Len=118 TSval=4294943949 TSecr=145100233 [TCP PDU reassembled in 515]
  516  96.893580 192.168.1.30 → 192.168.1.69 TCP 66 3483 → 36717 [ACK] Seq=781 Ack=2614 Win=64256 Len=0 TSval=145100429 TSecr=4294943949
  517  96.893759 192.168.1.69 → 192.168.1.30 HTTP 391 POST /cometd HTTP/1.1  (text/json)
  518  96.895016 192.168.1.30 → 192.168.1.69 TCP 94 3483 → 36717 [PSH, ACK] Seq=781 Ack=2614 Win=64256 Len=28 TSval=145100430 TSecr=4294943949
  519  96.895825 192.168.1.30 → 192.168.1.69 TCP 191 HTTP/1.1 200 OK 
  520  96.896221 192.168.1.30 → 192.168.1.69 TCP 148 HTTP/1.1 200 OK  [TCP PDU reassembled in 520]
  521  96.905652 192.168.1.69 → 192.168.1.30 TCP 66 36717 → 3483 [ACK] Seq=2614 Ack=809 Win=6912 Len=0 TSval=4294943955 TSecr=145100430
  522  96.914087 192.168.1.69 → 192.168.1.30 TCP 66 51294 → 9000 [ACK] Seq=700 Ack=17248 Win=35366 Len=0 TSval=4294943955 TSecr=145100431
  523  97.021770 192.168.1.69 → 192.168.1.30 TCP 125 36717 → 3483 [PSH, ACK] Seq=2614 Ack=809 Win=6912 Len=59 TSval=4294943967 TSecr=145100430 [TCP PDU reassembled in 523]
  524  97.064034 192.168.1.30 → 192.168.1.69 TCP 66 3483 → 36717 [ACK] Seq=809 Ack=2673 Win=64256 Len=0 TSval=145100599 TSecr=4294943967
  525  97.111221 192.168.1.30 → 192.168.1.69 TCP 268 [TCP Retransmission] 9000 → 51297 [PSH, ACK] Seq=2828 Ack=4994 Win=65280 Len=202 TSval=145100646 TSecr=4294943952
  526  97.114975 192.168.1.69 → 192.168.1.30 TCP 78 [TCP ACKed unseen segment] 51297 → 9000 [ACK] Seq=4994 Ack=3030 Win=6912 Len=0 TSval=4294943976 TSecr=145100646 SLE=2828 SRE=2953
  527  97.152168 192.168.1.69 → 192.168.1.30 HTTP 391 POST /cometd HTTP/1.1  (text/json)
  528  97.153438 192.168.1.30 → 192.168.1.69 TCP 94 3483 → 36717 [PSH, ACK] Seq=809 Ack=2673 Win=64256 Len=28 TSval=145100689 TSecr=4294943967
  529  97.154020 192.168.1.30 → 192.168.1.69 TCP 191 HTTP/1.1 200 OK 
  530  97.154405 192.168.1.30 → 192.168.1.69 TCP 148 HTTP/1.1 200 OK  [TCP PDU reassembled in 530]
  531  97.158068 192.168.1.69 → 192.168.1.30 TCP 66 36717 → 3483 [ACK] Seq=2673 Ack=837 Win=6912 Len=0 TSval=4294943980 TSecr=145100689
  532  97.160169 192.168.1.69 → 192.168.1.30 TCP 66 51297 → 9000 [ACK] Seq=5319 Ack=3155 Win=6912 Len=0 TSval=4294943981 TSecr=145100689
  533  97.160197 192.168.1.30 → 192.168.1.69 HTTP/JSON 143 HTTP/1.1 200 OK , JSON (application/json)
  534  97.161215 192.168.1.69 → 192.168.1.30 TCP 66 51294 → 9000 [ACK] Seq=700 Ack=17330 Win=35366 Len=0 TSval=4294943981 TSecr=145100690
  535  97.163766 192.168.1.69 → 192.168.1.30 TCP 66 51297 → 9000 [ACK] Seq=5319 Ack=3232 Win=6912 Len=0 TSval=4294943981 TSecr=145100695
  536  97.191267 192.168.1.69 → 192.168.1.30 TCP 125 36717 → 3483 [PSH, ACK] Seq=2673 Ack=837 Win=6912 Len=59 TSval=4294943984 TSecr=145100689 [TCP PDU reassembled in 536]
  537  97.235121 192.168.1.30 → 192.168.1.69 TCP 66 3483 → 36717 [ACK] Seq=837 Ack=2732 Win=64256 Len=0 TSval=145100770 TSecr=4294943984
  538  98.102353 192.168.1.69 → 192.168.1.30 TCP 125 36717 → 3483 [PSH, ACK] Seq=2732 Ack=837 Win=6912 Len=59 TSval=4294944075 TSecr=145100770 [TCP PDU reassembled in 538]
  539  98.154035 192.168.1.30 → 192.168.1.69 TCP 66 3483 → 36717 [ACK] Seq=837 Ack=2791 Win=64000 Len=0 TSval=145101689 TSecr=4294944075
  540  98.592893 192.168.1.69 → 192.168.1.30 HTTP 391 POST /cometd HTTP/1.1  (text/json)
  541  98.594234 192.168.1.30 → 192.168.1.69 TCP 94 3483 → 36717 [PSH, ACK] Seq=837 Ack=2791 Win=64000 Len=28 TSval=145102129 TSecr=4294944075
  542  98.594929 192.168.1.30 → 192.168.1.69 TCP 191 HTTP/1.1 200 OK 
  543  98.595313 192.168.1.30 → 192.168.1.69 TCP 148 HTTP/1.1 200 OK  [TCP PDU reassembled in 543]
  544  98.599039 192.168.1.69 → 192.168.1.30 TCP 66 36717 → 3483 [ACK] Seq=2791 Ack=865 Win=6912 Len=0 TSval=4294944125 TSecr=145102129
  545  98.601066 192.168.1.69 → 192.168.1.30 TCP 66 51297 → 9000 [ACK] Seq=5644 Ack=3357 Win=6912 Len=0 TSval=4294944125 TSecr=145102130
  546  98.601099 192.168.1.30 → 192.168.1.69 HTTP/JSON 143 HTTP/1.1 200 OK , JSON (application/json)
  547  98.602212 192.168.1.69 → 192.168.1.30 TCP 66 51294 → 9000 [ACK] Seq=700 Ack=17412 Win=35366 Len=0 TSval=4294944125 TSecr=145102130
  548  98.604249 192.168.1.69 → 192.168.1.30 TCP 66 51297 → 9000 [ACK] Seq=5644 Ack=3434 Win=6912 Len=0 TSval=4294944125 TSecr=145102136
  549  98.728617 192.168.1.69 → 192.168.1.30 TCP 125 36717 → 3483 [PSH, ACK] Seq=2791 Ack=865 Win=6912 Len=59 TSval=4294944137 TSecr=145102129 [TCP PDU reassembled in 549]
  550  98.774542 192.168.1.30 → 192.168.1.69 TCP 66 3483 → 36717 [ACK] Seq=865 Ack=2850 Win=64000 Len=0 TSval=145102310 TSecr=4294944137
  551  98.875704 192.168.1.69 → 192.168.1.30 TCP 125 36717 → 3483 [PSH, ACK] Seq=2850 Ack=865 Win=6912 Len=59 TSval=4294944152 TSecr=145102310 [TCP PDU reassembled in 551]
  552  98.928999 192.168.1.30 → 192.168.1.69 TCP 66 3483 → 36717 [ACK] Seq=865 Ack=2909 Win=64000 Len=0 TSval=145102464 TSecr=4294944152
  553  99.962443 192.168.1.69 → 192.168.1.30 TCP 125 36717 → 3483 [PSH, ACK] Seq=2909 Ack=865 Win=6912 Len=59 TSval=4294944260 TSecr=145102464
  554 100.015811 192.168.1.30 → 192.168.1.69 TCP 66 3483 → 36717 [ACK] Seq=865 Ack=2968 Win=65280 Len=0 TSval=145103551 TSecr=4294944260
  555 100.156903 192.168.1.30 → 192.168.1.69 TCP 96 3483 → 36717 [PSH, ACK] Seq=865 Ack=2968 Win=65280 Len=30 TSval=145103692 TSecr=4294944260
  556 100.159974 192.168.1.69 → 192.168.1.30 TCP 66 36717 → 3483 [ACK] Seq=2968 Ack=895 Win=6912 Len=0 TSval=4294944281 TSecr=145103692
  557 100.171545 192.168.1.69 → 192.168.1.30 TCP 125 36717 → 3483 [PSH, ACK] Seq=2968 Ack=895 Win=6912 Len=59 TSval=4294944282 TSecr=145103692
  558 100.218116 192.168.1.30 → 192.168.1.69 TCP 66 3483 → 36717 [ACK] Seq=895 Ack=3027 Win=65280 Len=0 TSval=145103753 TSecr=4294944282
  559 100.988246 192.168.1.69 → 192.168.1.30 TCP 125 36717 → 3483 [PSH, ACK] Seq=3027 Ack=895 Win=6912 Len=59 TSval=4294944363 TSecr=145103753
  560 101.031770 192.168.1.30 → 192.168.1.69 TCP 66 3483 → 36717 [ACK] Seq=895 Ack=3086 Win=65280 Len=0 TSval=145104567 TSecr=4294944363
  561 101.183826 192.168.1.69 → 192.168.1.30 HTTP 391 POST /cometd HTTP/1.1  (text/json)
  562 101.185126 192.168.1.30 → 192.168.1.69 TCP 94 3483 → 36717 [PSH, ACK] Seq=895 Ack=3086 Win=65280 Len=28 TSval=145104720 TSecr=4294944363
  563 101.185763 192.168.1.30 → 192.168.1.69 TCP 191 HTTP/1.1 200 OK 
  564 101.186199 192.168.1.30 → 192.168.1.69 TCP 148 HTTP/1.1 200 OK  [TCP PDU reassembled in 564]
  565 101.193684 192.168.1.69 → 192.168.1.30 TCP 66 51297 → 9000 [ACK] Seq=5969 Ack=3559 Win=6912 Len=0 TSval=4294944384 TSecr=145104721
  566 101.193714 192.168.1.69 → 192.168.1.30 TCP 66 51294 → 9000 [ACK] Seq=700 Ack=17494 Win=35366 Len=0 TSval=4294944384 TSecr=145104721
  567 101.193722 192.168.1.30 → 192.168.1.69 HTTP/JSON 143 HTTP/1.1 200 OK , JSON (application/json)
  568 101.198262 192.168.1.69 → 192.168.1.30 TCP 66 51297 → 9000 [ACK] Seq=5969 Ack=3636 Win=6912 Len=0 TSval=4294944384 TSecr=145104729
  569 101.229590 192.168.1.69 → 192.168.1.30 TCP 66 36717 → 3483 [ACK] Seq=3086 Ack=923 Win=6912 Len=0 TSval=4294944388 TSecr=145104720
  570 101.345000 192.168.1.69 → 192.168.1.30 TCP 125 36717 → 3483 [PSH, ACK] Seq=3086 Ack=923 Win=6912 Len=59 TSval=4294944399 TSecr=145104720
  571 101.352315 192.168.1.69 → 192.168.1.30 HTTP 391 POST /cometd HTTP/1.1  (text/json)
  572 101.353433 192.168.1.30 → 192.168.1.69 TCP 94 3483 → 36717 [PSH, ACK] Seq=923 Ack=3145 Win=65280 Len=28 TSval=145104889 TSecr=4294944399
  573 101.353999 192.168.1.30 → 192.168.1.69 TCP 191 HTTP/1.1 200 OK 
  574 101.354520 192.168.1.30 → 192.168.1.69 TCP 148 HTTP/1.1 200 OK  [TCP PDU reassembled in 574]
  575 101.356883 192.168.1.69 → 192.168.1.30 TCP 66 36717 → 3483 [ACK] Seq=3145 Ack=951 Win=6912 Len=0 TSval=4294944400 TSecr=145104889
  576 101.360525 192.168.1.69 → 192.168.1.30 TCP 66 51297 → 9000 [ACK] Seq=6294 Ack=3761 Win=6912 Len=0 TSval=4294944401 TSecr=145104889
  577 101.360556 192.168.1.30 → 192.168.1.69 HTTP/JSON 143 HTTP/1.1 200 OK , JSON (application/json)
  578 101.361198 192.168.1.69 → 192.168.1.30 TCP 66 51294 → 9000 [ACK] Seq=700 Ack=17576 Win=35366 Len=0 TSval=4294944401 TSecr=145104890
  579 101.363375 192.168.1.69 → 192.168.1.30 TCP 66 51297 → 9000 [ACK] Seq=6294 Ack=3838 Win=6912 Len=0 TSval=4294944401 TSecr=145104896
  580 101.513178 192.168.1.69 → 192.168.1.30 TCP 125 36717 → 3483 [PSH, ACK] Seq=3145 Ack=951 Win=6912 Len=59 TSval=4294944416 TSecr=145104889 [TCP PDU reassembled in 580]
  581 101.561554 192.168.1.30 → 192.168.1.69 TCP 66 3483 → 36717 [ACK] Seq=951 Ack=3204 Win=65280 Len=0 TSval=145105097 TSecr=4294944416
  582 101.583901 192.168.1.69 → 192.168.1.30 HTTP 391 POST /cometd HTTP/1.1  (text/json)
  583 101.585099 192.168.1.30 → 192.168.1.69 TCP 94 3483 → 36717 [PSH, ACK] Seq=951 Ack=3204 Win=65280 Len=28 TSval=145105120 TSecr=4294944416
  584 101.585821 192.168.1.30 → 192.168.1.69 TCP 191 HTTP/1.1 200 OK 
  585 101.586282 192.168.1.30 → 192.168.1.69 TCP 148 HTTP/1.1 200 OK  [TCP PDU reassembled in 585]
  586 101.596810 192.168.1.69 → 192.168.1.30 TCP 66 36717 → 3483 [ACK] Seq=3204 Ack=979 Win=6912 Len=0 TSval=4294944424 TSecr=145105120
  587 101.596815 192.168.1.69 → 192.168.1.30 TCP 66 51297 → 9000 [ACK] Seq=6619 Ack=3963 Win=6912 Len=0 TSval=4294944424 TSecr=145105121
  588 101.596846 192.168.1.30 → 192.168.1.69 HTTP/JSON 143 HTTP/1.1 200 OK , JSON (application/json)
  589 101.596870 192.168.1.69 → 192.168.1.30 TCP 66 51294 → 9000 [ACK] Seq=700 Ack=17658 Win=35366 Len=0 TSval=4294944424 TSecr=145105122
  590 101.607564 192.168.1.69 → 192.168.1.30 TCP 66 51297 → 9000 [ACK] Seq=6619 Ack=4040 Win=6912 Len=0 TSval=4294944425 TSecr=145105132
  591 101.667067 192.168.1.69 → 192.168.1.30 TCP 125 36717 → 3483 [PSH, ACK] Seq=3204 Ack=979 Win=6912 Len=59 TSval=4294944431 TSecr=145105120 [TCP PDU reassembled in 591]
  592 101.716516 192.168.1.30 → 192.168.1.69 TCP 66 3483 → 36717 [ACK] Seq=979 Ack=3263 Win=65024 Len=0 TSval=145105252 TSecr=4294944431
  593 101.763668 192.168.1.69 → 192.168.1.30 HTTP 391 POST /cometd HTTP/1.1  (text/json)
  594 101.764788 192.168.1.30 → 192.168.1.69 TCP 94 3483 → 36717 [PSH, ACK] Seq=979 Ack=3263 Win=65024 Len=28 TSval=145105300 TSecr=4294944431
  595 101.765666 192.168.1.30 → 192.168.1.69 TCP 191 HTTP/1.1 200 OK 
  596 101.766077 192.168.1.30 → 192.168.1.69 TCP 148 HTTP/1.1 200 OK  [TCP PDU reassembled in 596]
  597 101.771042 192.168.1.69 → 192.168.1.30 TCP 66 51297 → 9000 [ACK] Seq=6944 Ack=4165 Win=6912 Len=0 TSval=4294944442 TSecr=145105301
  598 101.771079 192.168.1.30 → 192.168.1.69 HTTP/JSON 143 HTTP/1.1 200 OK , JSON (application/json)
  599 101.772066 192.168.1.69 → 192.168.1.30 TCP 66 51294 → 9000 [ACK] Seq=700 Ack=17740 Win=35366 Len=0 TSval=4294944442 TSecr=145105301
  600 101.774180 192.168.1.69 → 192.168.1.30 TCP 66 51297 → 9000 [ACK] Seq=6944 Ack=4242 Win=6912 Len=0 TSval=4294944442 TSecr=145105306
  601 101.781360 192.168.1.69 → 192.168.1.30 TCP 66 36717 → 3483 [ACK] Seq=3263 Ack=1007 Win=6912 Len=0 TSval=4294944443 TSecr=145105300
  602 101.799177 192.168.1.69 → 192.168.1.30 TCP 125 36717 → 3483 [PSH, ACK] Seq=3263 Ack=1007 Win=6912 Len=59 TSval=4294944445 TSecr=145105300 [TCP PDU reassembled in 602]
  603 101.840346 192.168.1.30 → 192.168.1.69 TCP 66 3483 → 36717 [ACK] Seq=1007 Ack=3322 Win=65024 Len=0 TSval=145105376 TSecr=4294944445
  604 102.079587 192.168.1.69 → 192.168.1.30 TCP 125 36717 → 3483 [PSH, ACK] Seq=3322 Ack=1007 Win=6912 Len=59 TSval=4294944473 TSecr=145105376 [TCP PDU reassembled in 604]
  605 102.121483 192.168.1.30 → 192.168.1.69 TCP 66 3483 → 36717 [ACK] Seq=1007 Ack=3381 Win=65024 Len=0 TSval=145105657 TSecr=4294944473
  606 102.174473 192.168.1.69 → 192.168.1.30 HTTP 391 POST /cometd HTTP/1.1  (text/json)
  607 102.175928 192.168.1.30 → 192.168.1.69 TCP 94 3483 → 36717 [PSH, ACK] Seq=1007 Ack=3381 Win=65024 Len=28 TSval=145105711 TSecr=4294944473
  608 102.176810 192.168.1.30 → 192.168.1.69 TCP 191 HTTP/1.1 200 OK 
  609 102.177234 192.168.1.30 → 192.168.1.69 TCP 148 HTTP/1.1 200 OK  [TCP PDU reassembled in 609]
  610 102.181171 192.168.1.69 → 192.168.1.30 TCP 66 51297 → 9000 [ACK] Seq=7269 Ack=4367 Win=6912 Len=0 TSval=4294944483 TSecr=145105712
  611 102.181206 192.168.1.30 → 192.168.1.69 HTTP/JSON 143 HTTP/1.1 200 OK , JSON (application/json)
  612 102.182390 192.168.1.69 → 192.168.1.30 TCP 66 51294 → 9000 [ACK] Seq=700 Ack=17822 Win=35366 Len=0 TSval=4294944483 TSecr=145105712
  613 102.184517 192.168.1.69 → 192.168.1.30 TCP 66 51297 → 9000 [ACK] Seq=7269 Ack=4444 Win=6912 Len=0 TSval=4294944483 TSecr=145105716
  614 102.218902 192.168.1.69 → 192.168.1.30 TCP 66 36717 → 3483 [ACK] Seq=3381 Ack=1035 Win=6912 Len=0 TSval=4294944487 TSecr=145105711
  615 102.250284 192.168.1.69 → 192.168.1.30 TCP 125 36717 → 3483 [PSH, ACK] Seq=3381 Ack=1035 Win=6912 Len=59 TSval=4294944490 TSecr=145105711 [TCP PDU reassembled in 615]
  616 102.292011 192.168.1.30 → 192.168.1.69 TCP 66 3483 → 36717 [ACK] Seq=1035 Ack=3440 Win=65024 Len=0 TSval=145105827 TSecr=4294944490
  617 102.393421 192.168.1.69 → 192.168.1.30 HTTP 391 POST /cometd HTTP/1.1  (text/json)
  618 102.394738 192.168.1.30 → 192.168.1.69 TCP 94 3483 → 36717 [PSH, ACK] Seq=1035 Ack=3440 Win=65024 Len=28 TSval=145105930 TSecr=4294944490
  619 102.395462 192.168.1.30 → 192.168.1.69 TCP 191 HTTP/1.1 200 OK 
  620 102.395939 192.168.1.30 → 192.168.1.69 TCP 148 HTTP/1.1 200 OK  [TCP PDU reassembled in 620]
  621 102.399431 192.168.1.69 → 192.168.1.30 TCP 66 36717 → 3483 [ACK] Seq=3440 Ack=1063 Win=6912 Len=0 TSval=4294944505 TSecr=145105930
  622 102.402097 192.168.1.69 → 192.168.1.30 TCP 66 51297 → 9000 [ACK] Seq=7594 Ack=4569 Win=6912 Len=0 TSval=4294944505 TSecr=145105931
  623 102.402129 192.168.1.30 → 192.168.1.69 HTTP/JSON 143 HTTP/1.1 200 OK , JSON (application/json)
  624 102.403889 192.168.1.69 → 192.168.1.30 TCP 66 51294 → 9000 [ACK] Seq=700 Ack=17904 Win=35366 Len=0 TSval=4294944505 TSecr=145105931
  625 102.405476 192.168.1.69 → 192.168.1.30 TCP 66 51297 → 9000 [ACK] Seq=7594 Ack=4646 Win=6912 Len=0 TSval=4294944505 TSecr=145105937
  626 102.555211 192.168.1.69 → 192.168.1.30 TCP 125 36717 → 3483 [PSH, ACK] Seq=3440 Ack=1063 Win=6912 Len=59 TSval=4294944520 TSecr=145105930 [TCP PDU reassembled in 626]
  627 102.564658 192.168.1.69 → 192.168.1.30 HTTP 391 POST /cometd HTTP/1.1  (text/json)
  628 102.566115 192.168.1.30 → 192.168.1.69 TCP 94 3483 → 36717 [PSH, ACK] Seq=1063 Ack=3499 Win=64768 Len=28 TSval=145106101 TSecr=4294944520
  629 102.566990 192.168.1.30 → 192.168.1.69 TCP 191 HTTP/1.1 200 OK 
  630 102.567462 192.168.1.30 → 192.168.1.69 TCP 148 HTTP/1.1 200 OK  [TCP PDU reassembled in 630]
  631 102.572670 192.168.1.69 → 192.168.1.30 TCP 66 36717 → 3483 [ACK] Seq=3499 Ack=1091 Win=6912 Len=0 TSval=4294944522 TSecr=145106101
  632 102.574109 192.168.1.69 → 192.168.1.30 TCP 66 51297 → 9000 [ACK] Seq=7919 Ack=4771 Win=6912 Len=0 TSval=4294944522 TSecr=145106102
  633 102.574137 192.168.1.30 → 192.168.1.69 HTTP/JSON 143 HTTP/1.1 200 OK , JSON (application/json)
  634 102.575125 192.168.1.69 → 192.168.1.30 TCP 66 51294 → 9000 [ACK] Seq=700 Ack=17986 Win=35366 Len=0 TSval=4294944522 TSecr=145106102
  635 102.578894 192.168.1.69 → 192.168.1.30 TCP 66 51297 → 9000 [ACK] Seq=7919 Ack=4848 Win=6912 Len=0 TSval=4294944523 TSecr=145106109
  636 102.704006 192.168.1.69 → 192.168.1.30 TCP 184 36717 → 3483 [PSH, ACK] Seq=3499 Ack=1091 Win=6912 Len=118 TSval=4294944535 TSecr=145106101 [TCP PDU reassembled in 636]
  637 102.758648 192.168.1.30 → 192.168.1.69 TCP 66 3483 → 36717 [ACK] Seq=1091 Ack=3617 Win=64768 Len=0 TSval=145106294 TSecr=4294944535
  638 102.841685 192.168.1.69 → 192.168.1.30 HTTP 391 POST /cometd HTTP/1.1  (text/json)
  639 102.843091 192.168.1.30 → 192.168.1.69 TCP 94 3483 → 36717 [PSH, ACK] Seq=1091 Ack=3617 Win=64768 Len=28 TSval=145106378 TSecr=4294944535
  640 102.843687 192.168.1.30 → 192.168.1.69 TCP 191 HTTP/1.1 200 OK 
  641 102.844202 192.168.1.30 → 192.168.1.69 TCP 148 HTTP/1.1 200 OK  [TCP PDU reassembled in 641]
  642 102.846151 192.168.1.69 → 192.168.1.30 TCP 66 36717 → 3483 [ACK] Seq=3617 Ack=1119 Win=6912 Len=0 TSval=4294944549 TSecr=145106378
  643 102.849903 192.168.1.69 → 192.168.1.30 TCP 66 51297 → 9000 [ACK] Seq=8244 Ack=4973 Win=6912 Len=0 TSval=4294944550 TSecr=145106379
  644 102.849930 192.168.1.30 → 192.168.1.69 HTTP/JSON 143 HTTP/1.1 200 OK , JSON (application/json)
  645 102.850603 192.168.1.69 → 192.168.1.30 TCP 66 51294 → 9000 [ACK] Seq=700 Ack=18068 Win=35366 Len=0 TSval=4294944550 TSecr=145106379
  646 102.852971 192.168.1.69 → 192.168.1.30 TCP 66 51297 → 9000 [ACK] Seq=8244 Ack=5050 Win=6912 Len=0 TSval=4294944550 TSecr=145106385
  647 102.879218 192.168.1.69 → 192.168.1.30 TCP 125 36717 → 3483 [PSH, ACK] Seq=3617 Ack=1119 Win=6912 Len=59 TSval=4294944552 TSecr=145106378 [TCP PDU reassembled in 647]
  648 102.930064 192.168.1.30 → 192.168.1.69 TCP 66 3483 → 36717 [ACK] Seq=1119 Ack=3676 Win=64768 Len=0 TSval=145106465 TSecr=4294944552
  649 103.056094 192.168.1.69 → 192.168.1.30 HTTP 391 POST /cometd HTTP/1.1  (text/json)
  650 103.057560 192.168.1.30 → 192.168.1.69 TCP 94 3483 → 36717 [PSH, ACK] Seq=1119 Ack=3676 Win=64768 Len=28 TSval=145106593 TSecr=4294944552
  651 103.058629 192.168.1.30 → 192.168.1.69 TCP 191 HTTP/1.1 200 OK 
  652 103.059043 192.168.1.30 → 192.168.1.69 TCP 148 HTTP/1.1 200 OK  [TCP PDU reassembled in 652]
  653 103.063211 192.168.1.69 → 192.168.1.30 TCP 66 51297 → 9000 [ACK] Seq=8569 Ack=5175 Win=6912 Len=0 TSval=4294944571 TSecr=145106594
  654 103.063246 192.168.1.30 → 192.168.1.69 HTTP/JSON 143 HTTP/1.1 200 OK , JSON (application/json)
  655 103.064071 192.168.1.69 → 192.168.1.30 TCP 66 51294 → 9000 [ACK] Seq=700 Ack=18150 Win=35366 Len=0 TSval=4294944571 TSecr=145106594
  656 103.066249 192.168.1.69 → 192.168.1.30 TCP 66 51297 → 9000 [ACK] Seq=8569 Ack=5252 Win=6912 Len=0 TSval=4294944571 TSecr=145106599
  657 103.099027 192.168.1.69 → 192.168.1.30 TCP 66 36717 → 3483 [ACK] Seq=3676 Ack=1147 Win=6912 Len=0 TSval=4294944575 TSecr=145106593
  658 103.252087 192.168.1.69 → 192.168.1.30 TCP 125 36717 → 3483 [PSH, ACK] Seq=3676 Ack=1147 Win=6912 Len=59 TSval=4294944590 TSecr=145106593 [TCP PDU reassembled in 658]
  659 103.304016 192.168.1.30 → 192.168.1.69 TCP 66 3483 → 36717 [ACK] Seq=1147 Ack=3735 Win=64768 Len=0 TSval=145106839 TSecr=4294944590
  660 103.363010 192.168.1.69 → 192.168.1.30 HTTP 391 POST /cometd HTTP/1.1  (text/json)
  661 103.364289 192.168.1.30 → 192.168.1.69 TCP 94 3483 → 36717 [PSH, ACK] Seq=1147 Ack=3735 Win=64768 Len=28 TSval=145106900 TSecr=4294944590
  662 103.364956 192.168.1.30 → 192.168.1.69 TCP 191 HTTP/1.1 200 OK 
  663 103.365437 192.168.1.30 → 192.168.1.69 TCP 148 HTTP/1.1 200 OK  [TCP PDU reassembled in 663]
  664 103.368931 192.168.1.69 → 192.168.1.30 TCP 66 36717 → 3483 [ACK] Seq=3735 Ack=1175 Win=6912 Len=0 TSval=4294944601 TSecr=145106900
  665 103.370829 192.168.1.69 → 192.168.1.30 TCP 66 51297 → 9000 [ACK] Seq=8894 Ack=5377 Win=6912 Len=0 TSval=4294944602 TSecr=145106900
  666 103.370864 192.168.1.30 → 192.168.1.69 HTTP/JSON 143 HTTP/1.1 200 OK , JSON (application/json)
  667 103.372212 192.168.1.69 → 192.168.1.30 TCP 66 51294 → 9000 [ACK] Seq=700 Ack=18232 Win=35366 Len=0 TSval=4294944602 TSecr=145106901
  668 103.373736 192.168.1.69 → 192.168.1.30 TCP 66 51297 → 9000 [ACK] Seq=8894 Ack=5454 Win=6912 Len=0 TSval=4294944602 TSecr=145106906
  669 103.394113 192.168.1.69 → 192.168.1.30 TCP 125 36717 → 3483 [PSH, ACK] Seq=3735 Ack=1175 Win=6912 Len=59 TSval=4294944604 TSecr=145106900 [TCP PDU reassembled in 669]
  670 103.444444 192.168.1.30 → 192.168.1.69 TCP 66 3483 → 36717 [ACK] Seq=1175 Ack=3794 Win=64512 Len=0 TSval=145106980 TSecr=4294944604
  671 103.823903 192.168.1.69 → 192.168.1.30 HTTP 391 POST /cometd HTTP/1.1  (text/json)
  672 103.825373 192.168.1.30 → 192.168.1.69 TCP 94 3483 → 36717 [PSH, ACK] Seq=1175 Ack=3794 Win=64512 Len=28 TSval=145107361 TSecr=4294944604
  673 103.826334 192.168.1.30 → 192.168.1.69 TCP 191 HTTP/1.1 200 OK 
  674 103.826829 192.168.1.30 → 192.168.1.69 TCP 148 HTTP/1.1 200 OK  [TCP PDU reassembled in 674]
  675 103.831398 192.168.1.69 → 192.168.1.30 TCP 66 51297 → 9000 [ACK] Seq=9219 Ack=5579 Win=6912 Len=0 TSval=4294944648 TSecr=145107362
  676 103.831440 192.168.1.30 → 192.168.1.69 HTTP/JSON 143 HTTP/1.1 200 OK , JSON (application/json)
  677 103.832435 192.168.1.69 → 192.168.1.30 TCP 66 51294 → 9000 [ACK] Seq=700 Ack=18314 Win=35366 Len=0 TSval=4294944648 TSecr=145107362
  678 103.834470 192.168.1.69 → 192.168.1.30 TCP 66 51297 → 9000 [ACK] Seq=9219 Ack=5656 Win=6912 Len=0 TSval=4294944648 TSecr=145107367
  679 103.869382 192.168.1.69 → 192.168.1.30 TCP 66 36717 → 3483 [ACK] Seq=3794 Ack=1203 Win=6912 Len=0 TSval=4294944652 TSecr=145107361
  680 104.013242 192.168.1.69 → 192.168.1.30 TCP 125 36717 → 3483 [PSH, ACK] Seq=3794 Ack=1203 Win=6912 Len=59 TSval=4294944666 TSecr=145107361 [TCP PDU reassembled in 680]
  681 104.021155 192.168.1.69 → 192.168.1.30 HTTP 391 POST /cometd HTTP/1.1  (text/json)
  682 104.022325 192.168.1.30 → 192.168.1.69 TCP 94 3483 → 36717 [PSH, ACK] Seq=1203 Ack=3853 Win=64512 Len=28 TSval=145107558 TSecr=4294944666
  683 104.023052 192.168.1.30 → 192.168.1.69 TCP 191 HTTP/1.1 200 OK 
  684 104.023426 192.168.1.30 → 192.168.1.69 TCP 148 HTTP/1.1 200 OK  [TCP PDU reassembled in 684]
  685 104.025236 192.168.1.69 → 192.168.1.30 TCP 66 36717 → 3483 [ACK] Seq=3853 Ack=1231 Win=6912 Len=0 TSval=4294944667 TSecr=145107558
  686 104.028658 192.168.1.69 → 192.168.1.30 TCP 66 51297 → 9000 [ACK] Seq=9544 Ack=5781 Win=6912 Len=0 TSval=4294944667 TSecr=145107558
  687 104.028692 192.168.1.30 → 192.168.1.69 HTTP/JSON 143 HTTP/1.1 200 OK , JSON (application/json)
  688 104.029974 192.168.1.69 → 192.168.1.30 TCP 66 51294 → 9000 [ACK] Seq=700 Ack=18396 Win=35366 Len=0 TSval=4294944668 TSecr=145107558
  689 104.031591 192.168.1.69 → 192.168.1.30 TCP 66 51297 → 9000 [ACK] Seq=9544 Ack=5858 Win=6912 Len=0 TSval=4294944668 TSecr=145107564
  690 104.104103 192.168.1.69 → 192.168.1.30 TCP 125 36717 → 3483 [PSH, ACK] Seq=3853 Ack=1231 Win=6912 Len=59 TSval=4294944675 TSecr=145107558 [TCP PDU reassembled in 690]
  691 104.144384 192.168.1.30 → 192.168.1.69 TCP 66 3483 → 36717 [ACK] Seq=1231 Ack=3912 Win=64512 Len=0 TSval=145107680 TSecr=4294944675
  692 104.193498 192.168.1.69 → 192.168.1.30 HTTP 391 POST /cometd HTTP/1.1  (text/json)
  693 104.195204 192.168.1.30 → 192.168.1.69 TCP 94 3483 → 36717 [PSH, ACK] Seq=1231 Ack=3912 Win=64512 Len=28 TSval=145107730 TSecr=4294944675
  694 104.196176 192.168.1.30 → 192.168.1.69 TCP 191 HTTP/1.1 200 OK 
  695 104.196906 192.168.1.30 → 192.168.1.69 TCP 148 HTTP/1.1 200 OK  [TCP PDU reassembled in 695]
  696 104.200698 192.168.1.69 → 192.168.1.30 TCP 66 36717 → 3483 [ACK] Seq=3912 Ack=1259 Win=6912 Len=0 TSval=4294944685 TSecr=145107730
  697 104.204392 192.168.1.69 → 192.168.1.30 TCP 66 51294 → 9000 [ACK] Seq=700 Ack=18478 Win=35366 Len=0 TSval=4294944685 TSecr=145107732
  698 104.208667 192.168.1.69 → 192.168.1.30 TCP 66 51297 → 9000 [ACK] Seq=9869 Ack=5983 Win=6912 Len=0 TSval=4294944685 TSecr=145107731
  699 104.208698 192.168.1.30 → 192.168.1.69 HTTP/JSON 143 HTTP/1.1 200 OK , JSON (application/json)
  700 104.222552 192.168.1.69 → 192.168.1.30 TCP 66 51297 → 9000 [ACK] Seq=9869 Ack=6060 Win=6912 Len=0 TSval=4294944687 TSecr=145107744
  701 104.235652 192.168.1.69 → 192.168.1.30 TCP 125 36717 → 3483 [PSH, ACK] Seq=3912 Ack=1259 Win=6912 Len=59 TSval=4294944687 TSecr=145107730 [TCP PDU reassembled in 701]
  702 104.284166 192.168.1.30 → 192.168.1.69 TCP 66 3483 → 36717 [ACK] Seq=1259 Ack=3971 Win=64512 Len=0 TSval=145107819 TSecr=4294944687
  703 104.379496 192.168.1.69 → 192.168.1.30 HTTP 390 POST /cometd HTTP/1.1  (text/json)
  704 104.380921 192.168.1.30 → 192.168.1.69 TCP 94 3483 → 36717 [PSH, ACK] Seq=1259 Ack=3971 Win=64512 Len=28 TSval=145107916 TSecr=4294944687
  705 104.381913 192.168.1.30 → 192.168.1.69 TCP 191 HTTP/1.1 200 OK 
  706 104.382712 192.168.1.30 → 192.168.1.69 TCP 147 HTTP/1.1 200 OK  [TCP PDU reassembled in 706]
  707 104.386533 192.168.1.69 → 192.168.1.30 TCP 66 51294 → 9000 [ACK] Seq=700 Ack=18559 Win=35366 Len=0 TSval=4294944703 TSecr=145107918
  708 104.419418 192.168.1.69 → 192.168.1.30 TCP 66 36717 → 3483 [ACK] Seq=3971 Ack=1287 Win=6912 Len=0 TSval=4294944707 TSecr=145107916
  709 104.419422 192.168.1.69 → 192.168.1.30 TCP 66 51297 → 9000 [ACK] Seq=10193 Ack=6185 Win=6912 Len=0 TSval=4294944707 TSecr=145107917
  710 104.419472 192.168.1.30 → 192.168.1.69 HTTP/JSON 143 HTTP/1.1 200 OK , JSON (application/json)
  711 104.443603 192.168.1.69 → 192.168.1.30 TCP 66 51297 → 9000 [ACK] Seq=10193 Ack=6262 Win=6912 Len=0 TSval=4294944709 TSecr=145107955
  712 104.461672 192.168.1.69 → 192.168.1.30 TCP 125 36717 → 3483 [PSH, ACK] Seq=3971 Ack=1287 Win=6912 Len=59 TSval=4294944711 TSecr=145107916 [TCP PDU reassembled in 712]
  713 104.502505 192.168.1.30 → 192.168.1.69 TCP 66 3483 → 36717 [ACK] Seq=1287 Ack=4030 Win=64256 Len=0 TSval=145108038 TSecr=4294944711
  714 104.564114 192.168.1.69 → 192.168.1.30 HTTP 390 POST /cometd HTTP/1.1  (text/json)
  715 104.565685 192.168.1.30 → 192.168.1.69 TCP 94 3483 → 36717 [PSH, ACK] Seq=1287 Ack=4030 Win=64256 Len=28 TSval=145108101 TSecr=4294944711
  716 104.566594 192.168.1.30 → 192.168.1.69 TCP 191 HTTP/1.1 200 OK 
  717 104.567167 192.168.1.30 → 192.168.1.69 TCP 147 HTTP/1.1 200 OK  [TCP PDU reassembled in 717]
  718 104.574532 192.168.1.69 → 192.168.1.30 TCP 66 51294 → 9000 [ACK] Seq=700 Ack=18640 Win=35366 Len=0 TSval=4294944722 TSecr=145108102
  719 104.578244 192.168.1.69 → 192.168.1.30 TCP 66 51297 → 9000 [ACK] Seq=10517 Ack=6387 Win=6912 Len=0 TSval=4294944722 TSecr=145108102
  720 104.578272 192.168.1.30 → 192.168.1.69 HTTP/JSON 143 HTTP/1.1 200 OK , JSON (application/json)
  721 104.583179 192.168.1.69 → 192.168.1.30 TCP 66 36717 → 3483 [ACK] Seq=4030 Ack=1315 Win=6912 Len=0 TSval=4294944723 TSecr=145108101
  722 104.593235 192.168.1.69 → 192.168.1.30 TCP 66 51297 → 9000 [ACK] Seq=10517 Ack=6464 Win=6912 Len=0 TSval=4294944724 TSecr=145108114
  723 104.595844 192.168.1.69 → 192.168.1.30 TCP 125 36717 → 3483 [PSH, ACK] Seq=4030 Ack=1315 Win=6912 Len=59 TSval=4294944724 TSecr=145108101 [TCP PDU reassembled in 723]
  724 104.641980 192.168.1.30 → 192.168.1.69 TCP 66 3483 → 36717 [ACK] Seq=1315 Ack=4089 Win=64256 Len=0 TSval=145108177 TSecr=4294944724
  725 105.108170 192.168.1.69 → 192.168.1.30 HTTP 390 POST /cometd HTTP/1.1  (text/json)
  726 105.109681 192.168.1.30 → 192.168.1.69 TCP 94 3483 → 36717 [PSH, ACK] Seq=1315 Ack=4089 Win=64256 Len=28 TSval=145108645 TSecr=4294944724
  727 105.110327 192.168.1.30 → 192.168.1.69 TCP 191 HTTP/1.1 200 OK 
  728 105.110859 192.168.1.30 → 192.168.1.69 TCP 147 HTTP/1.1 200 OK  [TCP PDU reassembled in 728]
  729 105.114028 192.168.1.69 → 192.168.1.30 TCP 66 51297 → 9000 [ACK] Seq=10841 Ack=6589 Win=6912 Len=0 TSval=4294944776 TSecr=145108646
  730 105.114056 192.168.1.30 → 192.168.1.69 HTTP/JSON 143 HTTP/1.1 200 OK , JSON (application/json)
  731 105.114618 192.168.1.69 → 192.168.1.30 TCP 66 51294 → 9000 [ACK] Seq=700 Ack=18721 Win=35366 Len=0 TSval=4294944776 TSecr=145108646
  732 105.118577 192.168.1.69 → 192.168.1.30 TCP 66 51297 → 9000 [ACK] Seq=10841 Ack=6666 Win=6912 Len=0 TSval=4294944776 TSecr=145108649
  733 105.149040 192.168.1.69 → 192.168.1.30 TCP 66 36717 → 3483 [ACK] Seq=4089 Ack=1343 Win=6912 Len=0 TSval=4294944780 TSecr=145108645
  734 105.172589 192.168.1.30 → 192.168.1.69 TCP 96 3483 → 36717 [PSH, ACK] Seq=1343 Ack=4089 Win=64256 Len=30 TSval=145108708 TSecr=4294944780
  735 105.175615 192.168.1.69 → 192.168.1.30 TCP 66 36717 → 3483 [ACK] Seq=4089 Ack=1373 Win=6912 Len=0 TSval=4294944782 TSecr=145108708
  736 105.194697 192.168.1.69 → 192.168.1.30 TCP 125 36717 → 3483 [PSH, ACK] Seq=4089 Ack=1373 Win=6912 Len=59 TSval=4294944784 TSecr=145108708 [TCP PDU reassembled in 736]
  737 105.249186 192.168.1.30 → 192.168.1.69 TCP 66 3483 → 36717 [ACK] Seq=1373 Ack=4148 Win=64256 Len=0 TSval=145108784 TSecr=4294944784
  738 105.279991 192.168.1.69 → 192.168.1.30 TCP 125 36717 → 3483 [PSH, ACK] Seq=4148 Ack=1373 Win=6912 Len=59 TSval=4294944792 TSecr=145108784 [TCP PDU reassembled in 738]
  739 105.280555 192.168.1.69 → 192.168.1.30 HTTP 391 POST /cometd HTTP/1.1  (text/json)
  740 105.282076 192.168.1.30 → 192.168.1.69 TCP 94 3483 → 36717 [PSH, ACK] Seq=1373 Ack=4207 Win=64256 Len=28 TSval=145108817 TSecr=4294944792
  741 105.282967 192.168.1.30 → 192.168.1.69 TCP 191 HTTP/1.1 200 OK 
  742 105.283675 192.168.1.30 → 192.168.1.69 TCP 148 HTTP/1.1 200 OK  [TCP PDU reassembled in 742]
  743 105.290197 192.168.1.69 → 192.168.1.30 TCP 66 51297 → 9000 [ACK] Seq=11166 Ack=6791 Win=6912 Len=0 TSval=4294944794 TSecr=145108818
  744 105.290225 192.168.1.30 → 192.168.1.69 HTTP/JSON 143 HTTP/1.1 200 OK , JSON (application/json)
  745 105.293241 192.168.1.69 → 192.168.1.30 TCP 66 51297 → 9000 [ACK] Seq=11166 Ack=6868 Win=6912 Len=0 TSval=4294944794 TSecr=145108825
  746 105.293945 192.168.1.69 → 192.168.1.30 TCP 66 51294 → 9000 [ACK] Seq=700 Ack=18803 Win=35366 Len=0 TSval=4294944794 TSecr=145108819
  747 105.319061 192.168.1.69 → 192.168.1.30 TCP 66 36717 → 3483 [ACK] Seq=4207 Ack=1401 Win=6912 Len=0 TSval=4294944797 TSecr=145108817
  748 105.405284 192.168.1.69 → 192.168.1.30 TCP 125 36717 → 3483 [PSH, ACK] Seq=4207 Ack=1401 Win=6912 Len=59 TSval=4294944805 TSecr=145108817 [TCP PDU reassembled in 748]
  749 105.450770 192.168.1.30 → 192.168.1.69 TCP 66 3483 → 36717 [ACK] Seq=1401 Ack=4266 Win=64000 Len=0 TSval=145108986 TSecr=4294944805
  750 105.619236 192.168.1.69 → 192.168.1.30 HTTP 391 POST /cometd HTTP/1.1  (text/json)
  751 105.620880 192.168.1.30 → 192.168.1.69 TCP 94 3483 → 36717 [PSH, ACK] Seq=1401 Ack=4266 Win=64000 Len=28 TSval=145109156 TSecr=4294944805
  752 105.621726 192.168.1.30 → 192.168.1.69 TCP 191 HTTP/1.1 200 OK 
  753 105.622116 192.168.1.30 → 192.168.1.69 TCP 148 HTTP/1.1 200 OK  [TCP PDU reassembled in 753]
  754 105.623871 192.168.1.69 → 192.168.1.30 TCP 66 36717 → 3483 [ACK] Seq=4266 Ack=1429 Win=6912 Len=0 TSval=4294944827 TSecr=145109156
  755 105.626592 192.168.1.69 → 192.168.1.30 TCP 66 51297 → 9000 [ACK] Seq=11491 Ack=6993 Win=6912 Len=0 TSval=4294944827 TSecr=145109157
  756 105.626625 192.168.1.30 → 192.168.1.69 HTTP/JSON 143 HTTP/1.1 200 OK , JSON (application/json)
  757 105.631559 192.168.1.69 → 192.168.1.30 TCP 66 51294 → 9000 [ACK] Seq=700 Ack=18885 Win=35366 Len=0 TSval=4294944828 TSecr=145109157
  758 105.633240 192.168.1.69 → 192.168.1.30 TCP 66 51297 → 9000 [ACK] Seq=11491 Ack=7070 Win=6912 Len=0 TSval=4294944828 TSecr=145109162
  759 105.780218 192.168.1.69 → 192.168.1.30 TCP 125 36717 → 3483 [PSH, ACK] Seq=4266 Ack=1429 Win=6912 Len=59 TSval=4294944843 TSecr=145109156 [TCP PDU reassembled in 759]
  760 105.785884 192.168.1.69 → 192.168.1.30 HTTP 392 POST /cometd HTTP/1.1  (text/json)
  761 105.787060 192.168.1.30 → 192.168.1.69 TCP 94 3483 → 36717 [PSH, ACK] Seq=1429 Ack=4325 Win=64000 Len=28 TSval=145109322 TSecr=4294944843
  762 105.787689 192.168.1.30 → 192.168.1.69 TCP 191 HTTP/1.1 200 OK 
  763 105.788031 192.168.1.30 → 192.168.1.69 TCP 148 HTTP/1.1 200 OK  [TCP PDU reassembled in 763]
  764 105.790182 192.168.1.69 → 192.168.1.30 TCP 66 36717 → 3483 [ACK] Seq=4325 Ack=1457 Win=6912 Len=0 TSval=4294944844 TSecr=145109322
  765 105.791948 192.168.1.69 → 192.168.1.30 TCP 66 51297 → 9000 [ACK] Seq=11817 Ack=7195 Win=6912 Len=0 TSval=4294944844 TSecr=145109323
  766 105.792068 192.168.1.30 → 192.168.1.69 HTTP/JSON 143 HTTP/1.1 200 OK , JSON (application/json)
  767 105.792863 192.168.1.69 → 192.168.1.30 TCP 66 51294 → 9000 [ACK] Seq=700 Ack=18967 Win=35366 Len=0 TSval=4294944844 TSecr=145109323
  768 105.795039 192.168.1.69 → 192.168.1.30 TCP 66 51297 → 9000 [ACK] Seq=11817 Ack=7272 Win=6912 Len=0 TSval=4294944844 TSecr=145109327
  769 105.864193 192.168.1.69 → 192.168.1.30 TCP 125 36717 → 3483 [PSH, ACK] Seq=4325 Ack=1457 Win=6912 Len=59 TSval=4294944851 TSecr=145109322 [TCP PDU reassembled in 769]
  770 105.918197 192.168.1.30 → 192.168.1.69 TCP 66 3483 → 36717 [ACK] Seq=1457 Ack=4384 Win=64000 Len=0 TSval=145109453 TSecr=4294944851
  771 106.203333 192.168.1.69 → 192.168.1.30 HTTP 392 POST /cometd HTTP/1.1  (text/json)
  772 106.204621 192.168.1.30 → 192.168.1.69 TCP 94 3483 → 36717 [PSH, ACK] Seq=1457 Ack=4384 Win=64000 Len=28 TSval=145109740 TSecr=4294944851
  773 106.205376 192.168.1.30 → 192.168.1.69 TCP 191 HTTP/1.1 200 OK 
  774 106.205898 192.168.1.30 → 192.168.1.69 TCP 148 HTTP/1.1 200 OK  [TCP PDU reassembled in 774]
  775 106.209248 192.168.1.69 → 192.168.1.30 TCP 66 36717 → 3483 [ACK] Seq=4384 Ack=1485 Win=6912 Len=0 TSval=4294944886 TSecr=145109740
  776 106.214526 192.168.1.69 → 192.168.1.30 TCP 66 51297 → 9000 [ACK] Seq=12143 Ack=7397 Win=6912 Len=0 TSval=4294944886 TSecr=145109741
  777 106.214527 192.168.1.69 → 192.168.1.30 TCP 66 51294 → 9000 [ACK] Seq=700 Ack=19049 Win=35366 Len=0 TSval=4294944886 TSecr=145109741
  778 106.214561 192.168.1.30 → 192.168.1.69 HTTP/JSON 143 HTTP/1.1 200 OK , JSON (application/json)
  779 106.219298 192.168.1.69 → 192.168.1.30 TCP 66 51297 → 9000 [ACK] Seq=12143 Ack=7474 Win=6912 Len=0 TSval=4294944887 TSecr=145109750
  780 106.333219 192.168.1.69 → 192.168.1.30 TCP 125 36717 → 3483 [PSH, ACK] Seq=4384 Ack=1485 Win=6912 Len=59 TSval=4294944898 TSecr=145109740 [TCP PDU reassembled in 780]
  781 106.385547 192.168.1.30 → 192.168.1.69 TCP 66 3483 → 36717 [ACK] Seq=1485 Ack=4443 Win=65280 Len=0 TSval=145109921 TSecr=4294944898
  782 106.444883 192.168.1.69 → 192.168.1.30 HTTP 392 POST /cometd HTTP/1.1  (text/json)
  783 106.446179 192.168.1.30 → 192.168.1.69 TCP 94 3483 → 36717 [PSH, ACK] Seq=1485 Ack=4443 Win=65280 Len=28 TSval=145109981 TSecr=4294944898
  784 106.446806 192.168.1.30 → 192.168.1.69 TCP 191 HTTP/1.1 200 OK 
  785 106.447200 192.168.1.30 → 192.168.1.69 TCP 148 HTTP/1.1 200 OK  [TCP PDU reassembled in 785]
  786 106.450417 192.168.1.69 → 192.168.1.30 TCP 66 36717 → 3483 [ACK] Seq=4443 Ack=1513 Win=6912 Len=0 TSval=4294944910 TSecr=145109981
  787 106.452577 192.168.1.69 → 192.168.1.30 TCP 66 51297 → 9000 [ACK] Seq=12469 Ack=7599 Win=6912 Len=0 TSval=4294944910 TSecr=145109982
  788 106.452605 192.168.1.30 → 192.168.1.69 HTTP/JSON 143 HTTP/1.1 200 OK , JSON (application/json)
  789 106.455330 192.168.1.69 → 192.168.1.30 TCP 66 51294 → 9000 [ACK] Seq=700 Ack=19131 Win=35366 Len=0 TSval=4294944910 TSecr=145109982
  790 106.473153 192.168.1.69 → 192.168.1.30 TCP 66 51297 → 9000 [ACK] Seq=12469 Ack=7676 Win=6912 Len=0 TSval=4294944912 TSecr=145109988
  791 106.485623 192.168.1.69 → 192.168.1.30 TCP 125 36717 → 3483 [PSH, ACK] Seq=4443 Ack=1513 Win=6912 Len=59 TSval=4294944913 TSecr=145109981 [TCP PDU reassembled in 791]
  792 106.526193 192.168.1.30 → 192.168.1.69 TCP 66 3483 → 36717 [ACK] Seq=1513 Ack=4502 Win=65280 Len=0 TSval=145110061 TSecr=4294944913
  793 110.180327 192.168.1.30 → 192.168.1.69 TCP 96 3483 → 36717 [PSH, ACK] Seq=1513 Ack=4502 Win=65280 Len=30 TSval=145113716 TSecr=4294944913
  794 110.253920 192.168.1.69 → 192.168.1.30 TCP 125 36717 → 3483 [PSH, ACK] Seq=4502 Ack=1543 Win=6912 Len=59 TSval=4294945290 TSecr=145113716 [TCP PDU reassembled in 794]
  795 110.305136 192.168.1.30 → 192.168.1.69 TCP 66 3483 → 36717 [ACK] Seq=1543 Ack=4561 Win=65280 Len=0 TSval=145113840 TSecr=4294945290
  796 111.454683 192.168.1.30 → 192.168.1.69 TCP 66 9000 → 51297 [FIN, ACK] Seq=7676 Ack=12469 Win=64512 Len=0 TSval=145114990 TSecr=4294944912
  797 111.477341 192.168.1.69 → 192.168.1.30 TCP 66 51297 → 9000 [FIN, ACK] Seq=12469 Ack=7677 Win=6912 Len=0 TSval=4294945412 TSecr=145114990
  798 111.477416 192.168.1.30 → 192.168.1.69 TCP 66 9000 → 51297 [ACK] Seq=7677 Ack=12470 Win=64512 Len=0 TSval=145115013 TSecr=4294945412
